date,title,description,source,url,content
2025-01-21T00:27:28Z,Meta Makes 'Intense Year' Forecast And Big Layoffs,"Meta Platforms is looking to cut its headcount by 5%, which shows the efficiency drive by the management. Read why META stock is a Buy.",SeekingAlpha,https://finnhub.io/api/news?id=42ff7fa260ef1842b1bc70b50ed3fbc6cc99426414931a5898700949c1885132,"Meta Platforms is looking to cut its headcount by 5%, which shows the efficiency drive by the management. Read why META stock is a Buy."
2025-01-22T23:48:22Z,"Exclusive-India watchdog faults probe of Foxconn hiring, orders new inquiry","India's powerful human rights watchdog has admonished labor officials for failure to adequately investigate evidence of employment discrimination at Foxconn, which makes Apple iPhones, and told them...",Finnhub,https://finnhub.io/api/news?id=b847f83554798de2eeec6171cdd46537d5d25a28f9b0be1b35cf01423e1fbf7b,"India's powerful human rights watchdog has admonished labor officials for failure to adequately investigate evidence of employment discrimination at Foxconn, which makes Apple iPhones, and told them..."
2025-01-22T23:18:18Z,IUSV: A Cost-Effective Value ETF With Strong Downside Protection And Growth Potential,"Invest in IUSV for cost-efficient value investing with downside protection, technology exposure, and strong performance. Read more on the ETF here.",SeekingAlpha,https://finnhub.io/api/news?id=95bbdc8a8311f63269a6ec18baad577540174aeb863e77000779616af0d3974a,"Invest in IUSV for cost-efficient value investing with downside protection, technology exposure, and strong performance. Read more on the ETF here."
2025-01-22T18:00:00Z,"How To Build A $100,000 Dividend Portfolio: SCHD As The Core For Income And Growth","SCHD ETF effectively combines dividend income and dividend growth, while offering investors a reduced Expense Ratio. Click here to read why SCHD is a Strong Buy.",SeekingAlpha,https://finnhub.io/api/news?id=8f7d563d7078791e271bf624695990f6087b61fabd27b38e050a889bfbd76ca2,"SCHD ETF effectively combines dividend income and dividend growth, while offering investors a reduced Expense Ratio. Click here to read why SCHD is a Strong Buy."
2025-01-22T17:53:00Z,Berkshire Hathaway Stock Had a Bad Day. There Are Lots of Reasons.,Berkshire Hathaway Stock Had a Bad Day. There Are Lots of Reasons.,MarketWatch,https://finnhub.io/api/news?id=73e71d6b8fe1ed82e3267e6bb2e58fb0a73a175c440f78c72d34de17d76e33ac,Berkshire Hathaway Stock Had a Bad Day. There Are Lots of Reasons.
2025-01-22T16:33:00Z,Apple Stock Is Sliding. It Might Just Be the Beginning.,Apple Stock Is Sliding. It Might Just Be the Beginning.,MarketWatch,https://finnhub.io/api/news?id=1ea8a28caa28df4a13a6156f8c8f4e1daeadb48b2f593f108887a27b77520b5a,Apple Stock Is Sliding. It Might Just Be the Beginning.
2025-01-22T12:12:33Z,Meta: Why I'll Buy Aggressively On Any Pullback,Meta Platforms investors celebrate another momentous year of outperforming the market. Click here to read an analysis of META stock now.,SeekingAlpha,https://finnhub.io/api/news?id=1e89397d7a69c669abf6b6ac67ac044d47480e07da6d195f73d6b93299b7c969,Meta Platforms investors celebrate another momentous year of outperforming the market. Click here to read an analysis of META stock now.
2025-01-22T11:15:14Z,Secrets To Outperforming QQQ In 2024 Without TMT Exposure,"Large-cap growth stocks surged in 2024, led by the Mag-7. See how our Funds Macro Portfolio beat Nasdaq with a focus on energy, defense, and Bitcoin.",SeekingAlpha,https://finnhub.io/api/news?id=077e6a6df020da5705063aaf94c544a9f26066b443e682be28ebbca8a1662b9a,"Large-cap growth stocks surged in 2024, led by the Mag-7. See how our Funds Macro Portfolio beat Nasdaq with a focus on energy, defense, and Bitcoin."
2025-01-22T11:06:32Z,Big Tech ETF rises sharply as these megacap stocks help lift S&P 500,Big Tech ETF rises sharply as these megacap stocks help lift S&P 500,MarketWatch,https://finnhub.io/api/news?id=0fbfe5694d576fd835cf98a7daab79ce688b8c47cec2beaf9f44675791110786,Big Tech ETF rises sharply as these megacap stocks help lift S&P 500
2025-01-22T10:06:45Z,IYW: Tech Stocks Due For A Breather,"IYWâs technical outlook shows negative momentum divergence, suggesting a possible test of the 200-day moving average. Click here to read why IYW ETF is a Hold.",SeekingAlpha,https://finnhub.io/api/news?id=c9054fc68fcfea700ed8d5a71d8d92eec901506895d2b6d1110347392788317e,"IYWâs technical outlook shows negative momentum divergence, suggesting a possible test of the 200-day moving average. Click here to read why IYW ETF is a Hold."
2025-01-22T09:55:00Z,Nvidia Is World’s Most Valuable Company Again. How Stargate and Trump Helped the Stock.,Nvidia Is World’s Most Valuable Company Again. How Stargate and Trump Helped the Stock.,MarketWatch,https://finnhub.io/api/news?id=ced0142598a7a650015125362d8b150b492a9d7e62e1382d43ddeee2d8e8011c,Nvidia Is World’s Most Valuable Company Again. How Stargate and Trump Helped the Stock.
2025-01-22T09:09:03Z,"Apple Miami Worldcenter opens Friday, January 24, in downtown Miami",The new store offers customers the full lineup of products and features an industry-leading environmental store design...,Finnhub,https://finnhub.io/api/news?id=694d30002912bbfd7d33c3e9fe53eddaa9ecf9501aef7055bd0e7a97ad861bcf,The new store offers customers the full lineup of products and features an industry-leading environmental store design...
2025-01-22T09:00:00Z,Harding Loevner Global Equity Q4 2024 Report,"The Global Equity composite fell 0.86% gross of fees in the fourth quarter, in line with the 0.89% decline of the MSCI ACWI Index.",SeekingAlpha,https://finnhub.io/api/news?id=88aa6dca33bf2b79b4dd6455ec870b2218dedbf9c6e71a1765d4f728ad2465b7,"The Global Equity composite fell 0.86% gross of fees in the fourth quarter, in line with the 0.89% decline of the MSCI ACWI Index."
2025-01-22T08:16:58Z,"Dow Jones Futures Rise: Oracle, AI Stocks Rally On $500 Billion 'Stargate' Plan; Netflix Spikes On Earnings","Dow Jones Futures Rise: Oracle, AI Stocks Rally On $500 Billion 'Stargate' Plan; Netflix Spikes On Earnings",DowJones,https://finnhub.io/api/news?id=6808e8cd54e854f53ba1f6ac9af30ec9fd67d355778dc798094dc7a1f953619d,"Dow Jones Futures Rise: Oracle, AI Stocks Rally On $500 Billion 'Stargate' Plan; Netflix Spikes On Earnings"
2025-01-22T07:18:35Z,Amazon: AWS Faces New Market Dynamics In 2025,"Amazon has reported a very high operating margin in AWS for the last three quarters, which has helped boost the overall operating income and EPS. Read more here.",SeekingAlpha,https://finnhub.io/api/news?id=f19740f378ec8684f6db9e2142956e50f53ec64f125ce045c36ac038434bc8f2,"Amazon has reported a very high operating margin in AWS for the last three quarters, which has helped boost the overall operating income and EPS. Read more here."
2025-01-22T07:07:06Z,Harvard University: Pioneer of modern data privacy Cynthia Dwork wins National Medal of Science,Harvard University: Pioneer of modern data privacy Cynthia Dwork wins National Medal of Science.Apple phones analyze user data without revealing information about individuals. Google Maps shows how...,Finnhub,https://finnhub.io/api/news?id=d3c2c12dc711ecd4ec3005624d512e22c5cab5365f56192ed8c6c81c61930f97,Harvard University: Pioneer of modern data privacy Cynthia Dwork wins National Medal of Science.Apple phones analyze user data without revealing information about individuals. Google Maps shows how...
2025-01-22T07:00:00Z,"Apple, Samsung, Intel and others shift away from China as tariffs loom","Apple, Samsung, Intel and others shift away from China as tariffs loom",MarketWatch,https://finnhub.io/api/news?id=737d56c812d2da7a8cd4dc6f801cbd8e4f0a36af02b53296080e0907de47150f,"Apple, Samsung, Intel and others shift away from China as tariffs loom"
2025-01-22T05:55:32Z,Apple: Time To Reprice The Equity Story,"Apple faces a challenging start to 2025, with iPhone sales down 8% YoY in November. Learn why I downgrade AAPL stock from hold to sell.",SeekingAlpha,https://finnhub.io/api/news?id=b7226b624ceacbce47c1d2e46cce7e8ff02a0e9de269898eb1029d5599c8f1d5,"Apple faces a challenging start to 2025, with iPhone sales down 8% YoY in November. Learn why I downgrade AAPL stock from hold to sell."
2025-01-22T05:30:00Z,Netflix Explodes Into a New Era,Netflix Explodes Into a New Era,DowJones,https://finnhub.io/api/news?id=fbff590008e2b8c33428151d9ab4d8aac05e262ae02f6af8478a44e78defa4d2,Netflix Explodes Into a New Era
2025-01-22T04:30:00Z,TikTok is still running. Companies helping it could face $850 billion hit.,TikTok is still running. Companies helping it could face $850 billion hit.,MarketWatch,https://finnhub.io/api/news?id=a98913edbfd014403982c8b1968eba5345ea81045ab2df407dd0f39b3ace3b04,TikTok is still running. Companies helping it could face $850 billion hit.
2025-01-22T01:00:00Z,Trump Could Be Good for Tech Stocks. This Trade Pays Off if They Rally.,Trump Could Be Good for Tech Stocks. This Trade Pays Off if They Rally.,MarketWatch,https://finnhub.io/api/news?id=962fa75402e089f6f0a2d4c469950baf5d6798c807deb42b775a61817395b448,Trump Could Be Good for Tech Stocks. This Trade Pays Off if They Rally.
2025-01-22T00:14:24Z,"Indonesia close to deal to lift Indonesian iPhone 16 ban, Bloomberg News reports","Indonesia is close to a deal with Apple Inc over an investment plan that could lift a ban on iPhone 16 sales in the country, Bloomberg News reported on Tuesday, citing an interview with investment...",Finnhub,https://finnhub.io/api/news?id=a3faaa6297238163554df968777b1124d7f84fe79e0016c63f6e7176cdfe0266,"Indonesia is close to a deal with Apple Inc over an investment plan that could lift a ban on iPhone 16 sales in the country, Bloomberg News reported on Tuesday, citing an interview with investment..."
2025-01-23T17:00:00Z,Former Apple Executive Asks $25.5 Million for San Francisco Apartment,Former Apple Executive Asks $25.5 Million for San Francisco Apartment,DowJones,https://finnhub.io/api/news?id=4078db91b61a488deda26e13b5fb18fb5a017c4b6c3f13448f62aab9e85a75d9,Former Apple Executive Asks $25.5 Million for San Francisco Apartment
2025-01-23T16:44:13Z,Arm Holdings: Sky-High Valuation Hinges On AI Speculation,"Arm Holdings faces geopolitical and market risks, especially with China. Learn why ARM stockâs valuation is too high despite AI hype and licensing royalties.",SeekingAlpha,https://finnhub.io/api/news?id=c18edc7d31c9360d9f568983ca638856cc8ea5d1e8ece288015e300b29a60797,"Arm Holdings faces geopolitical and market risks, especially with China. Learn why ARM stockâs valuation is too high despite AI hype and licensing royalties."
2025-01-23T15:24:00Z,"As Apple Earnings Near, More Investors Think the iPhone Maker’s Stock Is Primed to Fall","As Apple Earnings Near, More Investors Think the iPhone Maker’s Stock Is Primed to Fall",MarketWatch,https://finnhub.io/api/news?id=fe2546fb6d673c4aabb2bc2e0f0fd3361ac30b4513cba473749952c3617dad04,"As Apple Earnings Near, More Investors Think the iPhone Maker’s Stock Is Primed to Fall"
2025-01-23T14:42:05Z,IPhones with TikTok installed selling big on eBay after brief ban,"Some iPhones with the TikTok app, which is currently unavailable in the Apple and Google app stores, are fetching big bucks on eBay in the wake of the video-sharing app's brief ban in the United...",Finnhub,https://finnhub.io/api/news?id=e195242268999c7923486a6ec2e687406af251fd66b9756754a1a19c188404ae,"Some iPhones with the TikTok app, which is currently unavailable in the Apple and Google app stores, are fetching big bucks on eBay in the wake of the video-sharing app's brief ban in the United..."
2025-01-23T13:46:55Z,"Apple 2025 Outlook: AI Gets IQ Boost, Possible Smart Home Products","Apple 2025 Outlook: AI Gets IQ Boost, Possible Smart Home Products",DowJones,https://finnhub.io/api/news?id=f286c8ddd87440feb845fdc154dcffe577ff34d032bb22280ceb8f4bb10caec9,"Apple 2025 Outlook: AI Gets IQ Boost, Possible Smart Home Products"
2025-01-23T13:35:28Z,Epic Games kicks off plan to add third-party games to own mobile store,Fortnite maker Epic Games said on Thursday it will add 19 third-party games to its own marketplace app on Google's Android globally and 16 games on Apple's iOS in the European Union. ...,Finnhub,https://finnhub.io/api/news?id=865d6d46d2c5dc6a88a84b5e3f5ac903b9e080f674b2265391f59d5a9ffc5a7c,Fortnite maker Epic Games said on Thursday it will add 19 third-party games to its own marketplace app on Google's Android globally and 16 games on Apple's iOS in the European Union. ...
2025-01-23T13:10:52Z,"Perplexity debuts AI assistant on Android to challenge Alexa, ChatGPT",Artificial intelligence startup Perplexity launched an agent-based assistant for Android devices on Thursday as it looks to take on larger rival OpenAI's ChatGPT and incumbent assistants such as...,Finnhub,https://finnhub.io/api/news?id=a58f4080a67cd9468ef44354c6db38cf2359235309cca06a95af5f3062940e1a,Artificial intelligence startup Perplexity launched an agent-based assistant for Android devices on Thursday as it looks to take on larger rival OpenAI's ChatGPT and incumbent assistants such as...
2025-01-23T13:08:00Z,Bond investors are trimming ‘Magnificent Seven’ holdings — with one exception,Bond investors are trimming ‘Magnificent Seven’ holdings — with one exception,MarketWatch,https://finnhub.io/api/news?id=eab61b8510c7d5b978801eb93cacfd199182ea3e70f65aa3239308c3a51887e4,Bond investors are trimming ‘Magnificent Seven’ holdings — with one exception
2025-01-23T10:51:13Z,"Apple: a rebound takes hold, Wedbush puts fears into perspective","On Thursday morning, Apple shares were among the biggest gainers in the Dow Jones index on Wall Street, with Wedbush believing that the fears that have recently weighed on the stock are exaggerated.At...",Finnhub,https://finnhub.io/api/news?id=45a6ce14f4a7be341cdfbf4599ef56dbef06112829c5351f534bb5de5cda59cd,"On Thursday morning, Apple shares were among the biggest gainers in the Dow Jones index on Wall Street, with Wedbush believing that the fears that have recently weighed on the stock are exaggerated.At..."
2025-01-23T10:14:37Z,Apples Is Falling Behind In Smartphone Market Share And This Is Concerning,"Financial writer warns of significant headwinds for Apple Inc., including declining iPhone shipments in China and underinvestment in AI. Click for more on AAPL.",SeekingAlpha,https://finnhub.io/api/news?id=21c419e349b96319367a73efbd4043f09f91d50dcc0592ddaef9781fdffd0618,"Financial writer warns of significant headwinds for Apple Inc., including declining iPhone shipments in China and underinvestment in AI. Click for more on AAPL."
2025-01-23T07:53:07Z,"UK watchdog targets Apple, Google mobile ecosystems with new digital market powers","LONDON — Google's Android and Apple's iOS are facing fresh scrutiny from Britain's competition watchdog, which announced investigations Thursday targeting the two tech giants' mobile phone...",Finnhub,https://finnhub.io/api/news?id=efa7914ea65e69acac9836a26df2a509e581f018562c18abf37b29bd892b6ae3,"LONDON — Google's Android and Apple's iOS are facing fresh scrutiny from Britain's competition watchdog, which announced investigations Thursday targeting the two tech giants' mobile phone..."
2025-01-23T07:02:00Z,Dimon Says ‘Get Over It’ on Trump Tariffs. Why Markets Should Ignore That and 5 Other Things to Know Today.,Dimon Says ‘Get Over It’ on Trump Tariffs. Why Markets Should Ignore That and 5 Other Things to Know Today.,MarketWatch,https://finnhub.io/api/news?id=86e0c826de90fe356bafaeeef84b9a7aa6428ce693644ba65b974676e4e96ab4,Dimon Says ‘Get Over It’ on Trump Tariffs. Why Markets Should Ignore That and 5 Other Things to Know Today.
2025-01-23T07:00:00Z,"Apple, Google Mobile Ecosystems Face U.K. Probe Under New Tech Rules","Apple, Google Mobile Ecosystems Face U.K. Probe Under New Tech Rules",DowJones,https://finnhub.io/api/news?id=2ab94cf4858952333715a1e2f3f35af9b8d9605cc97f3eb6f6e719ff63d3f52e,"Apple, Google Mobile Ecosystems Face U.K. Probe Under New Tech Rules"
2025-01-23T06:53:00Z,"Apple Stock Rises. China and iPhone Worries Are Overdone, Says Wedbush.","Apple Stock Rises. China and iPhone Worries Are Overdone, Says Wedbush.",MarketWatch,https://finnhub.io/api/news?id=7321311080b7855aa9440575162eda5b940f23b7e396c3979b031fab31466d53,"Apple Stock Rises. China and iPhone Worries Are Overdone, Says Wedbush."
2025-01-23T06:40:00Z,Greenlight Capital Q4 2024 Letter,"The Greenlight Capital funds (the ""Partnerships"") returned 7.2% in 2024, net of fees and expenses, compared to 25.0% for the S&P 500 index. Read more here.",SeekingAlpha,https://finnhub.io/api/news?id=d413379bf64e2d2a6ba44f4bf2725e64910e18e457f0212a796f70e4a23a3df4,"The Greenlight Capital funds (the ""Partnerships"") returned 7.2% in 2024, net of fees and expenses, compared to 25.0% for the S&P 500 index. Read more here."
2025-01-23T06:33:13Z,"Apple Could Face Further Restrictions in Indonesia, Ministry Says","By Kimberley Kao Indonesia's industry ministry is pushing Apple to meet local investment requirements, saying that more of the U.S. tech giant's products could face restrictions in the country if...",Finnhub,https://finnhub.io/api/news?id=a2a3648a768ba5150e8a24005fe400312a96dac667e16d7d0e6359f0209915f0,"By Kimberley Kao Indonesia's industry ministry is pushing Apple to meet local investment requirements, saying that more of the U.S. tech giant's products could face restrictions in the country if..."
2025-01-23T05:52:00Z,The U.K. has new powers vs. tech giants. It’s probing Apple and Google.,The U.K. has new powers vs. tech giants. It’s probing Apple and Google.,MarketWatch,https://finnhub.io/api/news?id=5356fa0a389a1e4c945e3280d35014c54ba3a82a181991fb2ee8cf92307c804b,The U.K. has new powers vs. tech giants. It’s probing Apple and Google.
2025-01-23T05:11:18Z,UK to investigate Apple and Google's mobile ecosystems,"Britain launched an investigation into the smartphone browser market on Thursday, its second use of recently bulked up regulatory powers to take on tech titans. The country's antitrust...",Finnhub,https://finnhub.io/api/news?id=1a13bd9765d3347ed8a0ffe7e7e44f4c3b8872b7089f16d1bc82a1632a41b057,"Britain launched an investigation into the smartphone browser market on Thursday, its second use of recently bulked up regulatory powers to take on tech titans. The country's antitrust..."
2025-01-24T22:42:00Z,"Dow Jones Futures: Huge Earnings Due; Meta, Tesla, Microsoft Near Buy Points","Dow Jones Futures: Huge Earnings Due; Meta, Tesla, Microsoft Near Buy Points",DowJones,https://finnhub.io/api/news?id=87329b5a5ee460344c8f87db0f0de12d9e936dbf7493bb76e5c920b3f4a7b43c,"Dow Jones Futures: Huge Earnings Due; Meta, Tesla, Microsoft Near Buy Points"
2025-01-24T19:28:00Z,Mid-Cap Stocks Have Been in the Shadows. Why 2025 Could Be Their Year.,Mid-Cap Stocks Have Been in the Shadows. Why 2025 Could Be Their Year.,MarketWatch,https://finnhub.io/api/news?id=c55305439b8e85066674e5b9ed43858c1d6f2cc2964f3a15240d0e478482d0d4,Mid-Cap Stocks Have Been in the Shadows. Why 2025 Could Be Their Year.
2025-01-24T15:41:16Z,"Big Tech stocks mostly slump, with Nvidia heading for a large loss","Big Tech stocks mostly slump, with Nvidia heading for a large loss",MarketWatch,https://finnhub.io/api/news?id=8c3b17b22ca0fe7c3298c4b288a6b267d867a643087b06cfd8744e014f4ade2f,"Big Tech stocks mostly slump, with Nvidia heading for a large loss"
2025-01-24T15:39:08Z,"Apple Stock Today: Long Double Butterfly Option Trade Offers A Chance At $1,000 Profit","Apple Stock Today: Long Double Butterfly Option Trade Offers A Chance At $1,000 Profit",DowJones,https://finnhub.io/api/news?id=ef2999d1f08e9e487e8d45eb615e2424bd83ad2b351402f062f6f7b638ece0f0,"Apple Stock Today: Long Double Butterfly Option Trade Offers A Chance At $1,000 Profit"
2025-01-24T15:28:05Z,Apple : Miami Worldcenter opens to excited customers in downtown Miami,"PHOTOS January 24, 2025 Apple Miami Worldcenter opens to excited customers in downtown Miami Download image ...",Finnhub,https://finnhub.io/api/news?id=f6e654411ba1202059aa3ec4e5975be5566acfb47d2e41deec69ecb382a98c87,"PHOTOS January 24, 2025 Apple Miami Worldcenter opens to excited customers in downtown Miami Download image ..."
2025-01-24T14:06:00Z,Apple Stock Is Having a Rough January. Why This Analyst Kept His Buy Rating.,Apple Stock Is Having a Rough January. Why This Analyst Kept His Buy Rating.,MarketWatch,https://finnhub.io/api/news?id=d37f76b55ab75415d4f34fd124133068f95f371b1eaca70ac24107b198f7258c,Apple Stock Is Having a Rough January. Why This Analyst Kept His Buy Rating.
2025-01-24T14:01:10Z,CMA examines whether Apple and Google are hindering the growth of competing apps,Copyright © BusinessAMBE 2023Key takeawaysThe Competition and Markets Authority has launched an investigation into the influence of Apple and Google within their mobile ecosystems.The CMA...,Finnhub,https://finnhub.io/api/news?id=3d2c2617eae72e629d5138e6527ad89746fed81b4603ba704e124075dca5fb96,Copyright © BusinessAMBE 2023Key takeawaysThe Competition and Markets Authority has launched an investigation into the influence of Apple and Google within their mobile ecosystems.The CMA...
2025-01-24T14:00:00Z,Interesting Earnings Action Coming,"Netflix'sÂ post earnings pop, and why next week looms large in earnings. Contextualizing recent AI news.",SeekingAlpha,https://finnhub.io/api/news?id=b3c86a3bcbb1dd4d4a51284485c8fd40c5ac48978236fef8864481abbc167562,"Netflix'sÂ post earnings pop, and why next week looms large in earnings. Contextualizing recent AI news."
2025-01-24T13:19:00Z,The Stock Market Is at the Mercy of Big Tech and the Fed,The Stock Market Is at the Mercy of Big Tech and the Fed,MarketWatch,https://finnhub.io/api/news?id=989ed33a05854a40b4cae47a7865ac3914f996cd74dfa72a9538b3941bfb35a6,The Stock Market Is at the Mercy of Big Tech and the Fed
2025-01-24T12:29:00Z,"Beyond Oracle and Nvidia, these stocks and sectors can benefit from the Stargate AI venture","Beyond Oracle and Nvidia, these stocks and sectors can benefit from the Stargate AI venture",MarketWatch,https://finnhub.io/api/news?id=53080472197d0fa36413d1a180f3ddce42bf39496c3bf7371fd1b60b02781f73,"Beyond Oracle and Nvidia, these stocks and sectors can benefit from the Stargate AI venture"
2025-01-24T11:28:09Z,"Apple: downward momentum continues, BofA more cautious","Apple continued its downward trend on the New York Stock Exchange on Friday, the victim of cautious comments from Bank of America, which lowered its earnings forecasts for the Apple-based company.At...",Finnhub,https://finnhub.io/api/news?id=e848bbda16ac0dad2c51fe2c4d6793923f281d07cfd80f854c9a249994f6a20a,"Apple continued its downward trend on the New York Stock Exchange on Friday, the victim of cautious comments from Bank of America, which lowered its earnings forecasts for the Apple-based company.At..."
2025-01-24T11:14:57Z,Apple: Competition Heats Up,"Despite Apple having the strongest branding, its phone pricing remains one of the highest. Click here to read an updated analysis of AAPL stock now.",SeekingAlpha,https://finnhub.io/api/news?id=af287c7e5144bb34bf0e5cf55cf2df4267f71e589ad64aa08e821739eb867bc6,"Despite Apple having the strongest branding, its phone pricing remains one of the highest. Click here to read an updated analysis of AAPL stock now."
2025-01-24T09:59:00Z,Verizon Stock Rises After Earnings Beat. Those Price Hikes Are Paying Off.,Verizon Stock Rises After Earnings Beat. Those Price Hikes Are Paying Off.,MarketWatch,https://finnhub.io/api/news?id=a9300104e60c451a062662d0853a2ed3757aea681254d8fa36e33869069af86b,Verizon Stock Rises After Earnings Beat. Those Price Hikes Are Paying Off.
2025-01-24T08:15:00Z,My Expectation For Apple After Q1 2025 Earnings (Rating Downgrade),"Apple's Q1/25 results face concerns due to declining iPhone sales in China and lower chip forecasts from TSMC, impacting stock performance. Learn more on AAPL stock here.",SeekingAlpha,https://finnhub.io/api/news?id=0a2378c2f588888ab39da9f53e9bc08b39eae0a8c34353eeefcb19c07b070f11,"Apple's Q1/25 results face concerns due to declining iPhone sales in China and lower chip forecasts from TSMC, impacting stock performance. Learn more on AAPL stock here."
2025-01-24T07:07:00Z,Verizon’s stock rises after biggest gain in five years on key subscriber metric,Verizon’s stock rises after biggest gain in five years on key subscriber metric,MarketWatch,https://finnhub.io/api/news?id=c07a0af6acd76c6835ffd3bc2afa644034cffb2fb6d53fae5cc705e18938a1db,Verizon’s stock rises after biggest gain in five years on key subscriber metric
2025-01-24T02:27:05Z,India's Tata Electronics acquires 60% stake in Pegatron Technology,Tata Electronics said on Friday it will acquire a majority 60% stake in Pegatron Technology India to grow its manufacturing footprint. ...,Finnhub,https://finnhub.io/api/news?id=fe3d824798b546f3b1b074378eba76d53e9e2fbb08427410d760112711d28d92,Tata Electronics said on Friday it will acquire a majority 60% stake in Pegatron Technology India to grow its manufacturing footprint. ...
2025-01-24T02:25:00Z,Franklin Growth Fund Q4 2024 Commentary,Franklin Growth Fund underperformed its S&P 500 Index benchmark in the fourth quarter. US stocks collectively rose in the fourth quarter of 2024.,SeekingAlpha,https://finnhub.io/api/news?id=c188dadba14948dc43f98b81c74645474f82a37a496765a58921da95209441e2,Franklin Growth Fund underperformed its S&P 500 Index benchmark in the fourth quarter. US stocks collectively rose in the fourth quarter of 2024.
2025-01-27T22:29:10Z,Broadcom Stock: Why I'm Buying The DeepSeek Dip And You Should Too,Broadcom stock sold off on Monday following DeepSeek's release. Read why I think AVGO represents a solid short-term and long-term Buy.,SeekingAlpha,https://finnhub.io/api/news?id=3eefa06d1594ee990b2422e4af339daaa882d33625bf898e05646d700119dc13,Broadcom stock sold off on Monday following DeepSeek's release. Read why I think AVGO represents a solid short-term and long-term Buy.
