date,title,description,source,url,content
2024-12-11T07:15:00Z,Allspring Large Cap Growth Fund Q3 2024 Commentary,The Allspring Large Cap Growth Fund underperformed the Russell 1000 Growth Index during the third quarter of 2024. Click here to read the full commentary. ,SeekingAlpha,https://finnhub.io/api/news?id=114db0ccb85d6ecb6e537dece5ce972a722d1287ab60a29e412e7ddb5c62cd58,The Allspring Large Cap Growth Fund underperformed the Russell 1000 Growth Index during the third quarter of 2024. Click here to read the full commentary. 
2024-12-11T05:29:07Z,"DBS Analyst Downgrades Apple Inc. (AAPL) to ‘Hold’ with $243 Price Target, Citing Valuation and Short-Term Challenges","We recently compiled a list of the 10 AI Stocks Taking Wall Street by Storm. In this article, we are going to take a look at where Apple Inc. (NASDAQ:AAPL) stands against the other AI stocks. Wall Street’s major indexes closed lower on Monday, December 9th, dragged down by a decline in Nvidia. The plunge pressured […]",Yahoo,https://finnhub.io/api/news?id=fb051a79f0195a7a29a56ca5b3b70e7bdfabb8cfc36358f9c1bdae165049db54,"We recently compiled a list of the 10 AI Stocks Taking Wall Street by Storm. In this article, we are going to take a look at where Apple Inc. (NASDAQ:AAPL) stands against the other AI stocks. Wall Street’s major indexes closed lower on Monday, December 9th, dragged down by a decline in Nvidia. The plunge pressured […]"
2024-12-11T05:27:06Z,Washington State University: Sunflare chosen as name for WSU's colorful next apple,"YAKIMA, Wash. - Washington State University's newest apple, WA 64, has an official brand name: Sunflare.Announced by WSU apple breeder Kate Evans on Dec. 10, 2024, at the Northwest Horticulture Expo...",Finnhub,https://finnhub.io/api/news?id=ee5d12148ed246a19db44791f038008d3bf1a114fc297c5cb84db53bdbc37dce,"YAKIMA, Wash. - Washington State University's newest apple, WA 64, has an official brand name: Sunflare.Announced by WSU apple breeder Kate Evans on Dec. 10, 2024, at the Northwest Horticulture Expo..."
2024-12-11T04:31:10Z,ICorner Launches Redesigned Website to Revolutionize Apple Shopping Experience in Bulgaria,"Sofia, Bulgaria - iCorner, one of Bulgaria's few authorized Apple resellers, is thrilled to announce the launch of its newly redesigned website, icornerstore.bg. With an updated design and a host of...",Finnhub,https://finnhub.io/api/news?id=22722505075347a3c858511773ff4958d1b22eaeb0a8a04056624f47f6927d7e,"Sofia, Bulgaria - iCorner, one of Bulgaria's few authorized Apple resellers, is thrilled to announce the launch of its newly redesigned website, icornerstore.bg. With an updated design and a host of..."
2024-12-11T04:31:10Z,Vdocipher Unveils Tips for Finding the Perfect Subscription Video on Demand Service,"SubscriptionDemand services have transformed how audiences consume entertainment, offering a vast library of movies, TV shows, and exclusive content at their fingertips. With an...",Finnhub,https://finnhub.io/api/news?id=f0c1a432b12b9e836be6d7d99f835bab624455e19bd7ee9cd6c17aca1691dd64,"SubscriptionDemand services have transformed how audiences consume entertainment, offering a vast library of movies, TV shows, and exclusive content at their fingertips. With an..."
2024-12-11T01:25:00Z,A Blockbuster Thanksgiving At The Box Office: Grab Your Popcorn For Upcoming Movie Release Data,"Record TSA travel, a Black Friday spending boom, and monster movie debuts set an upbeat tone ahead of the winter holidays.",SeekingAlpha,https://finnhub.io/api/news?id=eb5051c2c70ee2bb1a3930c4e2ae0fc10126dbaf86465fd781d70348a282ddcd,"Record TSA travel, a Black Friday spending boom, and monster movie debuts set an upbeat tone ahead of the winter holidays."
2024-12-12T23:02:00Z,"Broadcom shares pop, but is the AI chip stock overvalued?","Broadcom (AVGO) shares pop after the company reported quarterly earnings results and provided strong guidance. Morningstar Research Services equity analyst William Kerwin joins Julie Hyman and Josh Lipton on Market Domination Overtime to share his reaction to the earnings print and what it means for the chipmaker amid reports of a partnership with Apple (AAPL). ""We really saw these results as being largely in line with our expectations, both in terms of the Q4 results that got printed today, as well as the guidance that's provided for Broadcom's fiscal Q1,"" Kerwin says, noting, ""The market reaction is positive right now after hours. We think that's because the guidance for revenue in Q1 was a little bit above street consensus, but it was actually a little bit below our own estimates."" The analyst raises some concerns about valuation, saying, ""We don't love the price. We really love the company. We think it has a wide economic moat, but shares have just looked rich to us over the past few months."" To watch more expert insights and analysis on the latest market action, check out more Market Domination Overtime here. This post was written by Naomi Buchanan.",Yahoo,https://finnhub.io/api/news?id=3a1a2d6744fe368a2986c2df5deb2aac5ebca175174b18030d9ca238dcce917c,"Broadcom (AVGO) shares pop after the company reported quarterly earnings results and provided strong guidance. Morningstar Research Services equity analyst William Kerwin joins Julie Hyman and Josh Lipton on Market Domination Overtime to share his reaction to the earnings print and what it means for the chipmaker amid reports of a partnership with Apple (AAPL). ""We really saw these results as being largely in line with our expectations, both in terms of the Q4 results that got printed today, as well as the guidance that's provided for Broadcom's fiscal Q1,"" Kerwin says, noting, ""The market reaction is positive right now after hours. We think that's because the guidance for revenue in Q1 was a little bit above street consensus, but it was actually a little bit below our own estimates."" The analyst raises some concerns about valuation, saying, ""We don't love the price. We really love the company. We think it has a wide economic moat, but shares have just looked rich to us over the past few months."" To watch more expert insights and analysis on the latest market action, check out more Market Domination Overtime here. This post was written by Naomi Buchanan."
2024-12-12T22:53:00Z,Why Broadcom Stock Sagged Today,"Prominent chip stock Broadcom (NASDAQ: AVGO) got chipped on Thursday, on news that a top client might be accelerating a move away from its hardware.  Investors traded Broadcom's shares down by more than 1% on the news, a steeper fall than the 0.5% drop recorded by the bellwether S&P 500 index.  Early in the day, Bloomberg reported that Apple (NASDAQ: AAPL) intends next year to begin using one of its chips to power the Bluetooth and WiFi technology that connects iPhones and iPads, among other goods.",Yahoo,https://finnhub.io/api/news?id=0a17d59e38a98d2a3952f784bbd29aa523959c59f3bcaf40584b09a571edb91d,"Prominent chip stock Broadcom (NASDAQ: AVGO) got chipped on Thursday, on news that a top client might be accelerating a move away from its hardware.  Investors traded Broadcom's shares down by more than 1% on the news, a steeper fall than the 0.5% drop recorded by the bellwether S&P 500 index.  Early in the day, Bloomberg reported that Apple (NASDAQ: AAPL) intends next year to begin using one of its chips to power the Bluetooth and WiFi technology that connects iPhones and iPads, among other goods."
2024-12-12T19:49:44Z,Citi Analyst Highlights Apple's iOS 18.2 Launch as a Key Milestone in AI Expansion,"Atif Malik from Citi maintained a ""Buy"" rating on Apple with a $255 price target.",Yahoo,https://finnhub.io/api/news?id=8a17b91cfe9243f221fcf6f6dde941e7598a121e19b5f62a15bdbff8dc8537e1,"Atif Malik from Citi maintained a ""Buy"" rating on Apple with a $255 price target."
2024-12-12T19:47:18Z,"Apple nears switch to in-house Bluetooth and Wi-Fi chip for iPhone, smart home, Bloomberg reports","The chip, code-named Proxima, has been under development for several years and is now slated to go into the first iPhones and smart home devices produced in 2025, the report said, citing people familiar with the matter.  The iPhone maker's in-house chips will be produced by Taiwan Semiconductor Manufacturing Co, the report added.  At its annual developer conference in June, Apple said that it plans to use its own server chips to help power artificial intelligence features on its devices.",Yahoo,https://finnhub.io/api/news?id=02763e37969ba62decf5621d83fb598391f4ae1830e874e48788173af62afcd6,"The chip, code-named Proxima, has been under development for several years and is now slated to go into the first iPhones and smart home devices produced in 2025, the report said, citing people familiar with the matter.  The iPhone maker's in-house chips will be produced by Taiwan Semiconductor Manufacturing Co, the report added.  At its annual developer conference in June, Apple said that it plans to use its own server chips to help power artificial intelligence features on its devices."
2024-12-12T18:57:16Z,Apple nears switch from Broadcom chips; eyes in-house launch next year: Bloomberg,"Investing.com -- Apple Inc is set to replace Broadcom components with its own in-house chip for Bluetooth and Wi-Fi connections starting next year, Bloomberg reported Wednesday, citing people familiar with the matter.",Yahoo,https://finnhub.io/api/news?id=5818765384eb84989c33485d700da143dc446aae21bc1938605b87cdc8ed303a,"Investing.com -- Apple Inc is set to replace Broadcom components with its own in-house chip for Bluetooth and Wi-Fi connections starting next year, Bloomberg reported Wednesday, citing people familiar with the matter."
2024-12-12T18:37:06Z,Double Down On Shorting Nvidia In 2025,,SeekingAlpha,https://finnhub.io/api/news?id=555a2ba61a593bf7239d14749d934f93f0560239c4396f01c3fd84ec6386d486,
2024-12-12T18:35:57Z,United Airlines Integrates Apple AirTag Into App To Help Track Lost Bags,United Airlines passengers with lost baggage may be reunited with their items more quickly thanks to new integration between the carrier's mobile app and Apple AirTag.,Yahoo,https://finnhub.io/api/news?id=3cf09539d316294b34bfd1d44fc9d9cfc9d1f49eba68ba1123f0760d559b91b1,United Airlines passengers with lost baggage may be reunited with their items more quickly thanks to new integration between the carrier's mobile app and Apple AirTag.
2024-12-12T18:20:54Z,Broadcom Earnings: This Train Cannot Be Stopped,"Learn about Broadcom Inc.'s Q4 earnings report showcasing impressive growth driven by AI revenue, leading to AVGO stock being a Buy. Click for my earnings update.",SeekingAlpha,https://finnhub.io/api/news?id=126d54995fb959d9c680fbf187a86b72822358ab6142df07e1b0e6b86e5258bd,"Learn about Broadcom Inc.'s Q4 earnings report showcasing impressive growth driven by AI revenue, leading to AVGO stock being a Buy. Click for my earnings update."
2024-12-12T18:01:10Z,"Apple went public 44 years ago—what your $10,000 investment would be worth today","Apple has become the largest company in the world, becoming the world’s first firm to reach a $3 trillion valuation in 2022.",Yahoo,https://finnhub.io/api/news?id=6515f5ec97ba0de3c552dae8f7c0071294693d357300a6770c9deb51a4934a69,"Apple has become the largest company in the world, becoming the world’s first firm to reach a $3 trillion valuation in 2022."
2024-12-12T17:28:31Z,Google announces Android XR operating system for new headsets and smart glasses,"The tech giant has partnered with chip maker Qualcomm and Samsung on the project, and a Samsung-made headset will launch in 2025.",Yahoo,https://finnhub.io/api/news?id=1cb0e058f64368c611dffa0adeab5026307018c33537dc6520cad839f77e031a,"The tech giant has partnered with chip maker Qualcomm and Samsung on the project, and a Samsung-made headset will launch in 2025."
2024-12-12T17:26:16Z,Looking Glass rolls out Apple iOS hologram support,"Looking Glass, a hologram technology provider, has rolled out iOS support via Unity integration, according to a press release.The move brings Looking Glass 3D content tools to latest-gen Apple iPhone...",Finnhub,https://finnhub.io/api/news?id=014a00b7a3905536ae21f857ed53703e0d5ca36b5a597bf6f7f7fc4f6e250ff0,"Looking Glass, a hologram technology provider, has rolled out iOS support via Unity integration, according to a press release.The move brings Looking Glass 3D content tools to latest-gen Apple iPhone..."
2024-12-12T17:03:30Z,Apple reportedly partners with Broadcom,The AI chip is reportedly anticipated to be ready for mass production by 2026.,Yahoo,https://finnhub.io/api/news?id=d090d29b7f28699bb6063a863d27aa9630cbfae6ac8986261e7a1577d55e0958,The AI chip is reportedly anticipated to be ready for mass production by 2026.
2024-12-12T17:00:00Z,2024 Acura ZDX Type S: The Fast and the Forgettable,"The five-seat, four-door crossover offers robust performance akin to that of the Cadillac Lyriq. But in a less attractive package inside and out, writes Dan Neil.",Yahoo,https://finnhub.io/api/news?id=83d0e5a29bd64d3454ff038265efd944efbc5e20822cd759d8eba12fcab12a9b,"The five-seat, four-door crossover offers robust performance akin to that of the Cadillac Lyriq. But in a less attractive package inside and out, writes Dan Neil."
2024-12-12T16:00:34Z,"Google and Samsung debut Android XR amid VR, smart glasses push",Google debuts Android XR operating system gear toward VR headsets and AR smart glasses.,Yahoo,https://finnhub.io/api/news?id=703c570f9040ee9690b05aeb290ea448c805c6a06f2290e0d1e52a18cce80308,Google debuts Android XR operating system gear toward VR headsets and AR smart glasses.
2024-12-12T16:00:00Z,"Google Unveils Mixed-Reality Headset With Samsung, Taking on Apple and Meta","(Bloomberg) -- Alphabet Inc.’s Google and Samsung Electronics Co. unveiled a joint push into the mixed-reality market, introducing a new operating system and headset in a bid to challenge devices from Apple Inc. and Meta Platforms Inc.Most Read from BloombergHong Kong's Expat Party Hub Reshaped by Chinese InfluxBrace for a Nationwide Shuffle of Corporate HeadquartersAmerican Institute of Architects CEO ResignsCity Hall Is HiringCloud Computing Tax Threatens Chicago’s Silicon Valley DreamIn what",Yahoo,https://finnhub.io/api/news?id=784536ad382911204cea69db2367132a02841a22e01c3b22b2aa65a719b220ef,"(Bloomberg) -- Alphabet Inc.’s Google and Samsung Electronics Co. unveiled a joint push into the mixed-reality market, introducing a new operating system and headset in a bid to challenge devices from Apple Inc. and Meta Platforms Inc.Most Read from BloombergHong Kong's Expat Party Hub Reshaped by Chinese InfluxBrace for a Nationwide Shuffle of Corporate HeadquartersAmerican Institute of Architects CEO ResignsCity Hall Is HiringCloud Computing Tax Threatens Chicago’s Silicon Valley DreamIn what"
2024-12-12T15:33:26Z,There's only 2 Magnificent 7 names this strategist likes for 2025,"With some expecting a market correction in 2025, Harvest Portfolio Management CIO and Wall Street Beats partner Paul Meeks joins Brad Smith on Morning Brief to discuss his top stock picks for the new year. ""Of the [Magnificent Seven], the only ones I really support for growth and valuation at this level are Amazon (AMZN), which I think we'll see a nice upside surprise when they report, and also Nvidia (NVDA),"" Meeks says. ""I am going to, at least in the early part of 2025, stick with my AI infrastructure building plays. Those are primarily semiconductor companies like the aforementioned Nvidia. I'm also starting to warm up to Advanced Micro Devices (AMD) because it's come down a lot. I like Broadcom (AVGO), which will be reporting tonight, and I also like Marvell [Techonology] and Taiwan [Semiconductor Manufacturing Company]."" To watch more expert insights and analysis on the latest market action, check out more Morning Brief here. This post was written by Naomi Buchanan.",Yahoo,https://finnhub.io/api/news?id=cc8e08afd9eba5811a1cd1115a61fcc9de59c7019b597460ab124b06cc048178,"With some expecting a market correction in 2025, Harvest Portfolio Management CIO and Wall Street Beats partner Paul Meeks joins Brad Smith on Morning Brief to discuss his top stock picks for the new year. ""Of the [Magnificent Seven], the only ones I really support for growth and valuation at this level are Amazon (AMZN), which I think we'll see a nice upside surprise when they report, and also Nvidia (NVDA),"" Meeks says. ""I am going to, at least in the early part of 2025, stick with my AI infrastructure building plays. Those are primarily semiconductor companies like the aforementioned Nvidia. I'm also starting to warm up to Advanced Micro Devices (AMD) because it's come down a lot. I like Broadcom (AVGO), which will be reporting tonight, and I also like Marvell [Techonology] and Taiwan [Semiconductor Manufacturing Company]."" To watch more expert insights and analysis on the latest market action, check out more Morning Brief here. This post was written by Naomi Buchanan."
2024-12-12T15:32:36Z,Apple Stake Rises in Generate Investment Portfolio by $61.6 Million,Institutional Buying Pushes Apple Shares Higher in Q3 Filings,Yahoo,https://finnhub.io/api/news?id=ab1a9768412c320c367fe582c26df83b2196e6426afcb79a4399033797eccb09,Institutional Buying Pushes Apple Shares Higher in Q3 Filings
2024-12-12T15:21:00Z,"Apple, Microsoft, and Nvidia Will Be Worth $4 Trillion, and More Predictions From a Tech Bull","There are few Wall Street analysts more bullish on the technology sector than Wedbush Securities’ Dan Ives.  Apple  will be the first company to ever reach a market valuation of $4 trillion, swiftly followed by  Nvidia  and  Microsoft  according to Ives.  “We expect tech stocks to be up another 25% in 2025 under our base case,” Ives wrote in a research note.",Yahoo,https://finnhub.io/api/news?id=a6462f9b5a4bd99dc2c9d213b3ce7b597d45d9026af2eba571539773478ecb65,"There are few Wall Street analysts more bullish on the technology sector than Wedbush Securities’ Dan Ives.  Apple  will be the first company to ever reach a market valuation of $4 trillion, swiftly followed by  Nvidia  and  Microsoft  according to Ives.  “We expect tech stocks to be up another 25% in 2025 under our base case,” Ives wrote in a research note."
2024-12-12T14:32:46Z,3 Reasons 2025 Looks Scary For The S&P 500: VOO,"Discover 3 reasons why investors should approach the Vanguard S&P 500 ETF (VOO) with caution, and how to adjust your portfolio accordingly.",SeekingAlpha,https://finnhub.io/api/news?id=a2fb640bebd9af44ef5e80d54b9df16d790dd0e9c5b77664b9088370556afddb,"Discover 3 reasons why investors should approach the Vanguard S&P 500 ETF (VOO) with caution, and how to adjust your portfolio accordingly."
2024-12-12T14:09:00Z,"Warner Discovery to Restructure, Setting Up Potential ‘Strategic Opportunities’","The entertainment company would have two operating divisions, one focused on the legacy cable TV business and the other on streaming and studios.",Yahoo,https://finnhub.io/api/news?id=70a194384ad0c6b16cff51e86a5b52bf2e3eea001aefcd4e0c4bb1face7fe4c5,"The entertainment company would have two operating divisions, one focused on the legacy cable TV business and the other on streaming and studios."
2024-12-12T14:04:14Z,"Apple Devices Set to Switch to In-House Chip in Shift From Broadcom, Sources Say, Bloomberg Reports","--Apple's in-house component plans for its devices include switching to a homegrown chip starting next year, Bloomberg reported, citing people familiar with the matter. --The iPhone-maker's chip,...",Finnhub,https://finnhub.io/api/news?id=6cf2865fc1f520544bc8cee0a899e0945d7f7798f180cddd5dcd7a3fd2e762a8,"--Apple's in-house component plans for its devices include switching to a homegrown chip starting next year, Bloomberg reported, citing people familiar with the matter. --The iPhone-maker's chip,..."
2024-12-12T14:00:00Z,"Building A $50,000 Dividend Portfolio Across 2 ETFs And 10 High Yield Picks","Discover a dividend portfolio with minimized risks, growth potential, and attractive valuations - a better option than investing in VOO or VYM.",SeekingAlpha,https://finnhub.io/api/news?id=ed03f3821fdbad24b38b5f41414d70ef6a576a3ae6abac10e3fb3dc49db6538b,"Discover a dividend portfolio with minimized risks, growth potential, and attractive valuations - a better option than investing in VOO or VYM."
2024-12-12T12:56:17Z,Apple: Much To Prove In 2025,Apple shares struggle to keep up with big tech peers. Find out why AAPL stock may need significant upgrades to drive revenue growth in 2025.,SeekingAlpha,https://finnhub.io/api/news?id=9f5ac38136a835d9ed1c0950472effd7dc0ea27647c1073eacb306eff43faa43,Apple shares struggle to keep up with big tech peers. Find out why AAPL stock may need significant upgrades to drive revenue growth in 2025.
2024-12-12T12:30:00Z,4 Brilliant Reasons Why Apple Should Buy Bitcoin,"At its annual shareholders meeting on Dec. 10, Microsoft investors will vote on whether or not the business can invest in Bitcoin (CRYPTO: BTC).  Seeing the price of the digital asset soar 1,300% in the past five years and 140% just in 2024 (as of Dec. 9) is certainly drawing the attention of corporate executives who at least acknowledge that it might make sense to hold some Bitcoin on the balance sheet.  While no proposal is on the docket for Apple (NASDAQ: AAPL), the world's most valuable company, I believe the consumer tech juggernaut should start thinking about the world's top cryptocurrency.",Yahoo,https://finnhub.io/api/news?id=fe34e76fa7fa87ef34680624d02e14b382e9a8e0fc6a4520ec9e1933c28e9977,"At its annual shareholders meeting on Dec. 10, Microsoft investors will vote on whether or not the business can invest in Bitcoin (CRYPTO: BTC).  Seeing the price of the digital asset soar 1,300% in the past five years and 140% just in 2024 (as of Dec. 9) is certainly drawing the attention of corporate executives who at least acknowledge that it might make sense to hold some Bitcoin on the balance sheet.  While no proposal is on the docket for Apple (NASDAQ: AAPL), the world's most valuable company, I believe the consumer tech juggernaut should start thinking about the world's top cryptocurrency."
2024-12-12T12:02:48Z,Apple Pay users in Canada gain access to Klarna’s pay later services,Klarna's Pay in 4 service offers consumers ability to make four fixed payments for purchases.,Yahoo,https://finnhub.io/api/news?id=50f10979e04536d9b1618fe1bbe0b9db8271293d7e5f6de7260b4f9aebb79a30,Klarna's Pay in 4 service offers consumers ability to make four fixed payments for purchases.
2024-12-12T11:51:00Z,Nvidia Stock Falls. Microsoft’s Market Value Overtakes the Chip Maker.,Nvidia Stock Falls. Microsoft’s Market Value Overtakes the Chip Maker.,MarketWatch,https://finnhub.io/api/news?id=cb0f7c1cb13a0b54ea7c9ddd1e8f503e2ee1a3cd1cb10311ace80f23d5f23531,Nvidia Stock Falls. Microsoft’s Market Value Overtakes the Chip Maker.
2024-12-12T11:30:00Z,Google’s Quantum Boost Doesn’t Really Compute,"Alphabet’s sagging stock has been primed for any good news, but quantum computing’s payoff is years away at best.",Yahoo,https://finnhub.io/api/news?id=86facb53aa3a2138c97cf55bfe99be6ec44178cb258aa6977d856b2485d21449,"Alphabet’s sagging stock has been primed for any good news, but quantum computing’s payoff is years away at best."
2024-12-12T10:56:00Z,Pioneer Fundamental Growth Fund Q3 2024 Performance And Market Commentary,"Pioneer Fundamental Growth Fund portfolio returned 1.93% for the quarter, compared with 3.19% of its benchmark, the RLG. Read more here.",SeekingAlpha,https://finnhub.io/api/news?id=d7e61de78d3905dc0b3548cd0f93036b617f4a775fac398db91aa5606f53642d,"Pioneer Fundamental Growth Fund portfolio returned 1.93% for the quarter, compared with 3.19% of its benchmark, the RLG. Read more here."
2024-12-12T10:37:00Z,Apple vs. Nvidia: Which Will Hit a $4 Trillion Market Cap First?,"Apple (NASDAQ: AAPL) and Nvidia (NASDAQ: NVDA) are the two most valuable companies in the world.  The advantage Apple has in reaching $4 trillion first is that as of last week, it had a higher market cap than Nvidia -- nearly $3.7 trillion versus $3.4 trillion for the chipmaker.",Yahoo,https://finnhub.io/api/news?id=1fa9b4576ae82172b35481173426d6dd5200fb095d1172b9a1051484bc6e111f,"Apple (NASDAQ: AAPL) and Nvidia (NASDAQ: NVDA) are the two most valuable companies in the world.  The advantage Apple has in reaching $4 trillion first is that as of last week, it had a higher market cap than Nvidia -- nearly $3.7 trillion versus $3.4 trillion for the chipmaker."
2024-12-12T10:31:34Z,Apple's AI Chips Could Shake Up The Market (Rating Upgrade),"Apple is reportedly developing its own AI chip with Broadcom, potentially disrupting the AI chip market if sold externally. See why we shift from sell to hold.",SeekingAlpha,https://finnhub.io/api/news?id=63397f39fdf75150546e26ae0db188da1a99317a644e63783c5d2ee7e94ad62e,"Apple is reportedly developing its own AI chip with Broadcom, potentially disrupting the AI chip market if sold externally. See why we shift from sell to hold."
2024-12-12T10:10:00Z,Broadcom Earnings Are Coming. Its AI Ride Could Be Bumpy.,Broadcom Earnings Are Coming. Its AI Ride Could Be Bumpy.,MarketWatch,https://finnhub.io/api/news?id=e2619f70cdfccdce4f054f4e64fdc1897770d5044862f4f059ad3067374253f0,Broadcom Earnings Are Coming. Its AI Ride Could Be Bumpy.
2024-12-12T10:04:53Z,"Dow Jones Falls On Hot Inflation Data; Tesla Reverses Lower, Nvidia Slides","Dow Jones Falls On Hot Inflation Data; Tesla Reverses Lower, Nvidia Slides",DowJones,https://finnhub.io/api/news?id=5c0ba41a0a42ac7fc2fa11fea909f9fe4d067147d341bf8e4b8d785c6192e3bc,"Dow Jones Falls On Hot Inflation Data; Tesla Reverses Lower, Nvidia Slides"
