date,title,description,source,url,content
2024-12-24T11:00:47Z,Nvidia dominated 2024 big-time. Next year? Plenty of challenges.,"Nvidia dominated 2024, and 2025 is looking just as good. But there's turbulence on the horizon.",Yahoo,https://finnhub.io/api/news?id=0085398ccea7067f72a5152dbcd68bb7486a80d65d6400152a51f4bfcf8f0b66,"Nvidia dominated 2024, and 2025 is looking just as good. But there's turbulence on the horizon."
2024-12-24T10:37:13Z,"Latest Survey Shows Apple (AAPL) iPhone 16 Market Share, Momentum Lower Year Over Year","We recently published a list of Top 10 AI Stocks to Watch Right Now. In this article, we are going to take a look at where Apple Inc (NASDAQ:AAPL) stands against other top AI stocks to watch right now. Tom Hancock, GMO U.S. quality ETF portfolio manager, said in a latest program on CNBC that […]",Yahoo,https://finnhub.io/api/news?id=7060318fd9d308c86219a2fa744533d849fab31364f67fcd2877d6eeee6aa86a,"We recently published a list of Top 10 AI Stocks to Watch Right Now. In this article, we are going to take a look at where Apple Inc (NASDAQ:AAPL) stands against other top AI stocks to watch right now. Tom Hancock, GMO U.S. quality ETF portfolio manager, said in a latest program on CNBC that […]"
2024-12-24T10:24:12Z,"Trending tickers: Nvidia, TSMC, Apple, Honda and Vistry",The latest investor updates on stocks that are trending on Tuesday.,Yahoo,https://finnhub.io/api/news?id=da11a0a20e8bf8d3aac24288e11d61175799806a3b7cfed6c2d0c03341c1bd15,The latest investor updates on stocks that are trending on Tuesday.
2024-12-24T10:15:00Z,Want to Buy Shares of Warren Buffett's Investment Empire Before 2024 Is Over? Consider These 5 Magnificent Vanguard ETFs That Own Berkshire Hathaway Stock.,"Warren-Buffett-led Berkshire Hathaway (NYSE: BRK.A) (NYSE: BRK.B) is known for holding sizable stakes in public equities such as Apple, American Express, Bank of America, Coca-Cola, and Chevron.  Exchange-traded funds (ETFs) that hold Berkshire Hathaway offer a way to tap into Buffett's investment empire while maintaining diversification.  Berkshire Hathaway stock is a holding in many funds, including low-cost ETFs offered by investment management company Vanguard.",Yahoo,https://finnhub.io/api/news?id=6fe48cbbdbaefedcb62f357dda5afed6123e446af6c5db0c662658f02279eaa9,"Warren-Buffett-led Berkshire Hathaway (NYSE: BRK.A) (NYSE: BRK.B) is known for holding sizable stakes in public equities such as Apple, American Express, Bank of America, Coca-Cola, and Chevron.  Exchange-traded funds (ETFs) that hold Berkshire Hathaway offer a way to tap into Buffett's investment empire while maintaining diversification.  Berkshire Hathaway stock is a holding in many funds, including low-cost ETFs offered by investment management company Vanguard."
2024-12-24T09:47:15Z,Dow Jones Falls As Nvidia Hits Key Level; AI Chip Leader TSMC Breaks Out,Dow Jones Falls As Nvidia Hits Key Level; AI Chip Leader TSMC Breaks Out,DowJones,https://finnhub.io/api/news?id=e553d4f8cb2d401ff98561d09327f0d8501745083c8ec87c028c214247730589,Dow Jones Falls As Nvidia Hits Key Level; AI Chip Leader TSMC Breaks Out
2024-12-24T09:30:00Z,"2025 Analyst Outlook: Envision Research On AI, Dividends And Barbell Investing",Equity valuations are at lofty levels. Read why investors should not expect more of the same returns in 2025.,SeekingAlpha,https://finnhub.io/api/news?id=1ca574d6dfbce9d2cc55dcc9488998e2fcd0518cf76ed622e9d094bd3c9bd27d,Equity valuations are at lofty levels. Read why investors should not expect more of the same returns in 2025.
2024-12-24T09:30:00Z,Foxconn invests in EV battery plant in China to diversify business beyond Apple's iPhones,"Major Apple supplier Foxconn Technology Group is injecting 600 million yuan (US$82 million) into a new electric-vehicle (EV) battery plant in Zhengzhou, capital of central Chinese province Henan, where it runs the world's largest iPhone factory. The company, formally known as Hon Hai Precision Industry, on Monday announced its ""long-term investment"" in Foxconn New Energy Battery (Zhengzhou), which was established in October, according to a filing to the Taiwan Stock Exchange. The initial capital",Yahoo,https://finnhub.io/api/news?id=0d4b64ea4796a3da035b64ab1f64b772302421d70bbd5eb6b4888080c8dcd201,"Major Apple supplier Foxconn Technology Group is injecting 600 million yuan (US$82 million) into a new electric-vehicle (EV) battery plant in Zhengzhou, capital of central Chinese province Henan, where it runs the world's largest iPhone factory. The company, formally known as Hon Hai Precision Industry, on Monday announced its ""long-term investment"" in Foxconn New Energy Battery (Zhengzhou), which was established in October, according to a filing to the Taiwan Stock Exchange. The initial capital"
2024-12-24T01:06:00Z,Where Will Apple Stock Be in 1 Year?,"Apple (NASDAQ: AAPL) has done its part to lift the holiday spirits of its shareholders as 2024 comes to an end.  Indeed, Apple's 269% return in just the past five years has more than tripled the S&P 500 index's 82% gain over the same period.  Let's explore where Apple stock might be by this time next year.",Yahoo,https://finnhub.io/api/news?id=ea9e5c7e9ee158b75b0a80e8547f96136ed6f906df2a2abe300e3c70185f6d4f,"Apple (NASDAQ: AAPL) has done its part to lift the holiday spirits of its shareholders as 2024 comes to an end.  Indeed, Apple's 269% return in just the past five years has more than tripled the S&P 500 index's 82% gain over the same period.  Let's explore where Apple stock might be by this time next year."
2024-12-26T22:45:21Z,Apple (AAPL) Ascends While Market Falls: Some Facts to Note,"Apple (AAPL) concluded the recent trading session at $259.02, signifying a +0.32% move from its prior day's close.",Yahoo,https://finnhub.io/api/news?id=8d92b8b38bf722de47b0261725100c3e79c666145888735fa7fe886d409055c9,"Apple (AAPL) concluded the recent trading session at $259.02, signifying a +0.32% move from its prior day's close."
2024-12-26T20:38:20Z,Dan Niles on Apple (AAPL): Data is ‘Somewhat Disappointing’ and Stock is ‘Pretty Expensive,"We recently published a list of 10 AI Stocks Wall Street is Talking About. In this article, we are going to take a look at where Apple Inc. (NASDAQ:AAPL) stands against other AI stocks Wall Street is talking about. Defiance ETFs CEO and CIO Sylvia Jablonski said in a recent program on Bloomberg that there […]",Yahoo,https://finnhub.io/api/news?id=c2d053fa29bca5c95b4bdc49497560fdc54b882197c2d9a12863665384787130,"We recently published a list of 10 AI Stocks Wall Street is Talking About. In this article, we are going to take a look at where Apple Inc. (NASDAQ:AAPL) stands against other AI stocks Wall Street is talking about. Defiance ETFs CEO and CIO Sylvia Jablonski said in a recent program on Bloomberg that there […]"
2024-12-26T19:18:00Z,Apple Stock Hasn’t Had a Streak Like This Since 2010. What It Means as Value Nears $4 Trillion.,"Apple  is on the cusp of an artificial-intelligence-fueled “golden era of growth,” Wedbush analysts argued Thursday as they raised their price target on shares of the tech giant.  Wedbush analyst Dan Ives increased his price target to $325, a Wall Street high, and maintained an Outperform rating, just days after reiterating a $300 price target on the stock.  Analysts surveyed by FactSet have an average price target of $248.14 on Apple shares.",Yahoo,https://finnhub.io/api/news?id=ad3d1792cc794ceccaeaa70cd62c27d1e792a3d5b77b78e48adac2d9f3ec765d,"Apple  is on the cusp of an artificial-intelligence-fueled “golden era of growth,” Wedbush analysts argued Thursday as they raised their price target on shares of the tech giant.  Wedbush analyst Dan Ives increased his price target to $325, a Wall Street high, and maintained an Outperform rating, just days after reiterating a $300 price target on the stock.  Analysts surveyed by FactSet have an average price target of $248.14 on Apple shares."
2024-12-26T19:13:09Z,Apple Investors Cautioned Amid Recent Rally,BTIG analyst Jonathan Krinsky advises caution on Apple stock heading into January 2025.,Yahoo,https://finnhub.io/api/news?id=0e855f9a8a8af05bd515bad2c4c608fa7bd37dbe5f19f62104b5c212cfb7e25b,BTIG analyst Jonathan Krinsky advises caution on Apple stock heading into January 2025.
2024-12-26T16:40:31Z,"Apple On Cusp Of 'Golden Era Of Growth,' Analyst Says","With Apple stock in record-high territory, a longtime Apple bull on Thursday raised his price target to the highest level on Wall Street.",Yahoo,https://finnhub.io/api/news?id=d3409e4ebc25c6fb3ebb5fdef14d22a524758f08e7d76203f2935e60982ba45a,"With Apple stock in record-high territory, a longtime Apple bull on Thursday raised his price target to the highest level on Wall Street."
2024-12-26T13:00:23Z,Funds Want A Piece Of This Fashionable AI Stock — And Its Breakout,"With Nvidia AWOL, Ralph Lauren stock joins Meta among new buys by top funds as the fashion icon eyes a breakout.",Yahoo,https://finnhub.io/api/news?id=c72dbca7d39a39776425bec1ced46000d26fb78a84626c888a96c78b809b0584,"With Nvidia AWOL, Ralph Lauren stock joins Meta among new buys by top funds as the fashion icon eyes a breakout."
2024-12-26T16:27:00Z,The Biggest News Stories of 2024,"A lot happened in this year, from wars to the election to AI. Here’s a timeline, including some of the year’s best photos.",Yahoo,https://finnhub.io/api/news?id=71aa2175b91d07f85078ffdf87a2f0c75873b160be08ee014811b3e0c20d77a0,"A lot happened in this year, from wars to the election to AI. Here’s a timeline, including some of the year’s best photos."
2024-12-26T16:17:26Z,Apple's price target bumped to $325 by Wedbush,"Wedbush Securities is growing increasingly bullish on Apple (AAPL), with analyst Dan Ives raising the company's price target from $300 to $325. The upgrade comes as Apple approaches a $4 trillion market capitalization, and Ives cites the upcoming iPhone 16 cycle as the catalyst for what he calls a ""new golden era"" for the tech giant. Catalysts anchors Brad Smith and Brian Sozzi break down the details. To watch more expert insights and analysis on the latest market action, check out more Catalysts here. This post was written by Angel Smith",Yahoo,https://finnhub.io/api/news?id=0b9eb5b6114aac71a654410448ffc1bbb5927ead4a72ac34beae72d3cdf7c147,"Wedbush Securities is growing increasingly bullish on Apple (AAPL), with analyst Dan Ives raising the company's price target from $300 to $325. The upgrade comes as Apple approaches a $4 trillion market capitalization, and Ives cites the upcoming iPhone 16 cycle as the catalyst for what he calls a ""new golden era"" for the tech giant. Catalysts anchors Brad Smith and Brian Sozzi break down the details. To watch more expert insights and analysis on the latest market action, check out more Catalysts here. This post was written by Angel Smith"
2024-12-26T16:12:29Z,"Apple Stock to Hit $325, Wedbush Securities Cites ""Golden Era of Growth""",Apple on Track for $4 Trillion Market Cap as Wedbush Sets $325 Target,Yahoo,https://finnhub.io/api/news?id=786c327ca252816ee27002caf92f98a0c0aaa27b1d69c7077c7ba37f9b1b91fd,Apple on Track for $4 Trillion Market Cap as Wedbush Sets $325 Target
2024-12-26T15:59:16Z,Apple Stock Hits All-Time High Thursday as Analyst Sees 'Golden Era of Growth' With AI,"Apple shares closed at an all-time high Thursday after Wedbush analysts raised their price target for the stock, telling clients they expect the iPhone maker could be headed for a ""golden era of growth"" driven by demand for artificial intelligence.",Yahoo,https://finnhub.io/api/news?id=cc76e91b0f75cc677db5fc2331aeb7f62035585b89b21102d0c4d333e81085f4,"Apple shares closed at an all-time high Thursday after Wedbush analysts raised their price target for the stock, telling clients they expect the iPhone maker could be headed for a ""golden era of growth"" driven by demand for artificial intelligence."
2024-12-26T15:59:16Z,Apple Stock Gets Target Boost From Analyst Who Sees 'Golden Era of Growth' With AI,"Wedbush analysts raised their price target for Apple's stock Thursday, telling clients they expect the iPhone maker could be headed for a ""golden era of growth"" driven by demand for artificial intelligence.",Yahoo,https://finnhub.io/api/news?id=228f1d9394a256e9b858bc8faa70329d35a1155e4dd7891ba6fc75ec641c4df8,"Wedbush analysts raised their price target for Apple's stock Thursday, telling clients they expect the iPhone maker could be headed for a ""golden era of growth"" driven by demand for artificial intelligence."
2024-12-26T15:42:21Z,Apple stock touches intraday high after nod of confidence from Wall Street,Apple stock hit an all-time intraday high Thursday after a nod of confidence in its continued upswing from Wall Street.,Yahoo,https://finnhub.io/api/news?id=e48f261c4ce25b0f51457292466658002e46ea04dca19b16f89cdc3147e6a8f1,Apple stock hit an all-time intraday high Thursday after a nod of confidence in its continued upswing from Wall Street.
2024-12-26T15:41:29Z,Apple Inc. (AAPL): AI Feature Faces Criticism After False Headline Sparks BBC Complaint,"We recently compiled a list of the 10 AI News You Can’t Miss. In this article, we are going to take a look at where Apple Inc. (NASDAQ:AAPL) stands against the other AI stocks you can’t miss. According to a Department of Energy-backed study, U.S. data center power demand could nearly triple in the next three […]",Yahoo,https://finnhub.io/api/news?id=7f0935f4b4a9c4c45961ea9be6db506fff24ffbaf20df1876afce1a9b02078a1,"We recently compiled a list of the 10 AI News You Can’t Miss. In this article, we are going to take a look at where Apple Inc. (NASDAQ:AAPL) stands against the other AI stocks you can’t miss. According to a Department of Energy-backed study, U.S. data center power demand could nearly triple in the next three […]"
2024-12-26T14:55:00Z,Why this analyst thinks Apple stock has 'a difficult set-up for January',"Investing.com -- Apple Inc's (NASDAQ:AAPL) recent rally may face turbulence in the new year, according to a note from BTIG. The world's largest company has logged five consecutive weeks of gains over 2%, a streak last seen in 2010.",Yahoo,https://finnhub.io/api/news?id=b85a0694d987a90f8354bb8c03730a22b8c40aed5c1320aea2d2a1aa9f6878a5,"Investing.com -- Apple Inc's (NASDAQ:AAPL) recent rally may face turbulence in the new year, according to a note from BTIG. The world's largest company has logged five consecutive weeks of gains over 2%, a streak last seen in 2010."
2024-12-26T14:53:55Z,Apple Eyes 240M iPhone Boom Amid AI Revolution--Wedbush Hikes Target to $325,"AI-powered upgrades and robust demand fuel Wedbush's $325 target, projecting Apple's largest sales year ever",Yahoo,https://finnhub.io/api/news?id=1516fb1a819374b7e1c86c2b86e6e0f35e2ad4a7fd7bb0cdca527fc40e5fe448,"AI-powered upgrades and robust demand fuel Wedbush's $325 target, projecting Apple's largest sales year ever"
2024-12-26T14:44:54Z,Wedbush lifts Apple price target by $25 banking on AI-driven growth,"Investing.com -- Wedbush raised its price target on Apple Inc (NASDAQ:AAPL) to $325 from $300 banking on transformative AI-driven iPhone upgrade cycle poised to fuel growth into 2025. The brokerage maintained its ""outperform"" rating, projecting Apple’s market cap to cross the $4 trillion mark.",Yahoo,https://finnhub.io/api/news?id=56b5aeedadd1a7c713508215522d794d21b06b1e1c8bcde758f892ef84c811e7,"Investing.com -- Wedbush raised its price target on Apple Inc (NASDAQ:AAPL) to $325 from $300 banking on transformative AI-driven iPhone upgrade cycle poised to fuel growth into 2025. The brokerage maintained its ""outperform"" rating, projecting Apple’s market cap to cross the $4 trillion mark."
2024-12-26T14:30:09Z,Wall Street Bulls Look Optimistic About Apple (AAPL): Should You Buy?,"According to the average brokerage recommendation (ABR), one should invest in Apple (AAPL). It is debatable whether this highly sought-after metric is effective because Wall Street analysts' recommendations tend to be overly optimistic. Would it be worth investing in the stock?",Yahoo,https://finnhub.io/api/news?id=2debf3203718ba96893909afa7bcce0dc376a538ea2c03a3066d5cbd93c6e443,"According to the average brokerage recommendation (ABR), one should invest in Apple (AAPL). It is debatable whether this highly sought-after metric is effective because Wall Street analysts' recommendations tend to be overly optimistic. Would it be worth investing in the stock?"
2024-12-26T14:13:14Z,"From Microsoft to Nvidia, the AI agents are coming in 2025","Big Tech will lean heavily into AI agents in 2025. And if the technology works as promised, it could make som tedious tasks a lot easier.",Yahoo,https://finnhub.io/api/news?id=7c0b52c97f3f840e6385d2f59f82ecaaee98b2262f48a52b4240c3a276b5e777,"Big Tech will lean heavily into AI agents in 2025. And if the technology works as promised, it could make som tedious tasks a lot easier."
2024-12-26T14:00:00Z,"How To Build A Strategically Balanced $50,000 Dividend Portfolio To Be Well-Positioned For 2025","Learn how to build a $50,000 dividend portfolio to position yourself well for 2025 with a focus on dividend income, growth, and diversification.",SeekingAlpha,https://finnhub.io/api/news?id=9d183864ed70a18fc1686cc585a273143ae890c1b533464bb2dfd293fc385a66,"Learn how to build a $50,000 dividend portfolio to position yourself well for 2025 with a focus on dividend income, growth, and diversification."
2024-12-26T13:45:00Z,Apple Stock Price Target Gets Boost as AI-Driven Growth ‘Renaissance’ Approaches,"Apple  is on the cusp of an artificial-intelligence-fueled “golden era of growth,” Wedbush analysts argued Thursday as they raised their price target on shares of the tech giant.  The analysts increased their price target to $325, a Wall-Street high, and maintained an Outperform rating, just days after reiterating a $300 price target on the stock.  Analysts surveyed by FactSet have an average price target of $248.14 on  Apple  shares.",Yahoo,https://finnhub.io/api/news?id=d2d1d150e60ee2845900a0be6d53c8a15ee428e7c352947a1ef979165c6e117f,"Apple  is on the cusp of an artificial-intelligence-fueled “golden era of growth,” Wedbush analysts argued Thursday as they raised their price target on shares of the tech giant.  The analysts increased their price target to $325, a Wall-Street high, and maintained an Outperform rating, just days after reiterating a $300 price target on the stock.  Analysts surveyed by FactSet have an average price target of $248.14 on  Apple  shares."
2024-12-26T13:15:00Z,"7 Vanguard ETFs to Buy With $1,000 and Hold Forever",How does a double-digit average annual return over a decade sound?,Yahoo,https://finnhub.io/api/news?id=f396a9ad24cddf90a907dbe8132373b8b3543877cca0e9fcc04d23ef2c9f991b,How does a double-digit average annual return over a decade sound?
2024-12-26T12:34:56Z,"Apple, the world's most-valuable company, could soon be valued at more than $4 trillion.","Apple, the world's most-valuable company, could soon be valued at more than $4 trillion.",Yahoo,https://finnhub.io/api/news?id=c58756142c74d0f653cae27bf00a5e454bcd0afab510691b01d1b74266b4c84a,"Apple, the world's most-valuable company, could soon be valued at more than $4 trillion."
2024-12-26T10:30:00Z,Tech That Will Change Your Life in 2025,"Weather forecasts will get smarter, EVs could get pricier, crypto will be for everyday investors and AI will be everywhere",Yahoo,https://finnhub.io/api/news?id=633da55c5ad78154459634d377f2f4a6a16e1d358bac93664e3fa96ba78e2edc,"Weather forecasts will get smarter, EVs could get pricier, crypto will be for everyday investors and AI will be everywhere"
2024-12-26T10:06:00Z,4 of Wall Street's Most Prominent Artificial Intelligence (AI) Stocks Have Made a Shocking $1.23 Trillion Investment,"Nvidia, Meta Platforms, Alphabet, and Apple have collectively spent far more on this than they have on developing artificial intelligence (AI) solutions.",Yahoo,https://finnhub.io/api/news?id=b0a64d71b5d6051a38e4c39389c062dac891e04b707e5b075c206bd5a05e83ca,"Nvidia, Meta Platforms, Alphabet, and Apple have collectively spent far more on this than they have on developing artificial intelligence (AI) solutions."
2024-12-26T09:25:00Z,Prediction: 2 AI Stocks Will Be Worth More Than Apple Stock by Year-End in 2025,"Apple is currently the most valuable publicly traded company in the world, with a market value of $3.9 trillion.  The company has held that title for the better part of a decade but has yet to demonstrate it can monetize artificial intelligence (AI).  Nvidia (NASDAQ: NVDA) is currently worth $3.4 trillion.",Yahoo,https://finnhub.io/api/news?id=f27925e21278db9af282fb8538b4b37501cc5053b25afbeca54725f60105a7f1,"Apple is currently the most valuable publicly traded company in the world, with a market value of $3.9 trillion.  The company has held that title for the better part of a decade but has yet to demonstrate it can monetize artificial intelligence (AI).  Nvidia (NASDAQ: NVDA) is currently worth $3.4 trillion."
2024-12-26T02:00:00Z,Flying Was Already the Worst. Then America Stopped Using Headphones.,"Some travelers are confronting people who think it’s OK to have phone conversations on speaker, but it doesn’t always end well",Yahoo,https://finnhub.io/api/news?id=c33d29b1f8ae68e0d1054c50216e40095916aeca7189fddbdbf2530d7b2b4be1,"Some travelers are confronting people who think it’s OK to have phone conversations on speaker, but it doesn’t always end well"
2024-12-26T00:45:49Z,JGRO: Losing Steam Compared To Its Peers,"JGRO's performance was promising in its first 20 months, but it has lagged passive large-cap growth ETFs for six months. Read why JGRO ETF is a Hold.",SeekingAlpha,https://finnhub.io/api/news?id=2f6e89fae79deea794936c2ac7d63ab4f3bc65c77a832ce731932580fd5d7833,"JGRO's performance was promising in its first 20 months, but it has lagged passive large-cap growth ETFs for six months. Read why JGRO ETF is a Hold."
2024-12-27T23:08:21Z,Analyst Says Apple (AAPL) Stock is Expensive Amid ‘Slow-Developing’ Upgrade Cycle,"We recently published a list of Analysts Are Talking About These 10 AI Stocks. In this article, we are going to take a look at where Apple Inc. (NASDAQ:AAPL) stands against other stocks analysts are talking about. Marco Argenti, Chief Information Officer at Goldman Sachs, recently said that in 2025, the world will witness the […]",Yahoo,https://finnhub.io/api/news?id=eec3def7570ce2288d114aecc8537eca3d892b13f8534769137dc542cca6a9b3,"We recently published a list of Analysts Are Talking About These 10 AI Stocks. In this article, we are going to take a look at where Apple Inc. (NASDAQ:AAPL) stands against other stocks analysts are talking about. Marco Argenti, Chief Information Officer at Goldman Sachs, recently said that in 2025, the world will witness the […]"
2024-12-27T23:00:00Z,Santa Claus Deserted the Market. It’s Still Been a Good Year for Stocks.,"Investors are still sitting on a more than 25% gain for the year, and it’s arguable that the frenzied postelection bump pulled forward some of December’s typical gains. Nonetheless, the month’s anemic showing is atypical.",Yahoo,https://finnhub.io/api/news?id=cb7164526647323986802302fda1e867b4fd5e221a6171e11637d3d168982fb0,"Investors are still sitting on a more than 25% gain for the year, and it’s arguable that the frenzied postelection bump pulled forward some of December’s typical gains. Nonetheless, the month’s anemic showing is atypical."
2024-12-27T22:55:00Z,MicroStrategy Joins the Nasdaq-100 Stock Index!,And don't forget all the iPhone innovation.,Yahoo,https://finnhub.io/api/news?id=913ca90b2c287a1017d90325456ac75bbee8309b3b4cecf1a9ecae434314878a,And don't forget all the iPhone innovation.
2024-12-27T22:20:30Z,Big Tech's legal battles: What to watch for in 2025,"The US government spent much of 2024 cracking down on tech giants like Google (GOOGL, GOOG), Apple (AAPL), and Meta (META). The efforts started under former President Trump and then carried over into President Biden’s administration. Yahoo Finance senior legal reporter Alexis Keenan appears on Market Domination to discuss key events, including the DOJ's victory in its antitrust case against Google and what to watch for in 2025 as Trump takes office again.  To watch more expert insights and analysis on the latest market action, check out more Market Domination Overtime here. This post was written by Josh Lynch",Yahoo,https://finnhub.io/api/news?id=672182aa4e4e7adb6389e84b446f085240d92a13b80b560763c0701a9fc47d0f,"The US government spent much of 2024 cracking down on tech giants like Google (GOOGL, GOOG), Apple (AAPL), and Meta (META). The efforts started under former President Trump and then carried over into President Biden’s administration. Yahoo Finance senior legal reporter Alexis Keenan appears on Market Domination to discuss key events, including the DOJ's victory in its antitrust case against Google and what to watch for in 2025 as Trump takes office again.  To watch more expert insights and analysis on the latest market action, check out more Market Domination Overtime here. This post was written by Josh Lynch"
2024-12-27T19:59:00Z,Tech Slide Weighs on U.S. Stocks,"Major indexes, which had barely budged Thursday, remained on track to finish little changed for the week—and are closing in on strong full-year gains.",Yahoo,https://finnhub.io/api/news?id=1affc8a5ec78f8ac03d16edd11575e2aa5d52d9ff7c55fb35e5d5c9516c10b10,"Major indexes, which had barely budged Thursday, remained on track to finish little changed for the week—and are closing in on strong full-year gains."
