date,title,description,source,url,content
2024-11-18T22:23:51Z,Mag 7 vs. S&P 493: Is earnings growth beginning to slow?,"Magnificent Seven stocks — which is comprised of Alphabet (GOOGL, GOOG), Amazon (AMZN), Apple (AAPL), Meta Platforms (META), Microsoft (MSFT), Nvidia (NVDA), and Tesla (TSLA) — are experiencing a deceleration in growth across their earnings. Nvidia is the next and final member of the group to report earnings this Wednesday, November 20. Yahoo Finance acnhor Julie Hyman joins Asking for a Trend to compare the Mag 7's earnings growth compared to that of the rest of the S&P 500 (^GSPC), referring back to Solidarity Capital CEO Jeff McClean's comments to Yahoo Finance: ""I think there's going to continue to be broadening with the rest of the S&P 493."" To watch more expert insights and analysis on the latest market action, check out more Asking for a Trend here. This post was written by Luke Carberry Mogan.",Yahoo,https://finnhub.io/api/news?id=430f9b307b24d9a2bb9cca9f70b479d684de50e3833e1e8f0bffb5817b8a590a,"Magnificent Seven stocks — which is comprised of Alphabet (GOOGL, GOOG), Amazon (AMZN), Apple (AAPL), Meta Platforms (META), Microsoft (MSFT), Nvidia (NVDA), and Tesla (TSLA) — are experiencing a deceleration in growth across their earnings. Nvidia is the next and final member of the group to report earnings this Wednesday, November 20. Yahoo Finance acnhor Julie Hyman joins Asking for a Trend to compare the Mag 7's earnings growth compared to that of the rest of the S&P 500 (^GSPC), referring back to Solidarity Capital CEO Jeff McClean's comments to Yahoo Finance: ""I think there's going to continue to be broadening with the rest of the S&P 493."" To watch more expert insights and analysis on the latest market action, check out more Asking for a Trend here. This post was written by Luke Carberry Mogan."
2024-11-18T19:20:10Z,Apple Evaluates Branded TV as Smart Home Focus Grows,Apple is reportedly reevaluating plans to release a branded television,Yahoo,https://finnhub.io/api/news?id=6907e58db6dfd3d62620847b09f924818b5d0db563820c2e423f03902bf182ac,Apple is reportedly reevaluating plans to release a branded television
2024-11-18T17:51:29Z,"Globalstar plans to shift listing to Nasdaq, announces reverse stock split","Investing.com - Globalstar Inc (NYSE:GSAT). plans to shift its stock listing to the Nasdaq Global Select Market in early 2025 and execute a reverse stock split to boost visibility and attract more institutional investors, the satellite communications provider said on Monday.",Yahoo,https://finnhub.io/api/news?id=9b96740fd00928491d6a28bba01960f56763c6baa91861a4f4b85a55bde046de,"Investing.com - Globalstar Inc (NYSE:GSAT). plans to shift its stock listing to the Nasdaq Global Select Market in early 2025 and execute a reverse stock split to boost visibility and attract more institutional investors, the satellite communications provider said on Monday."
2024-11-18T16:55:58Z,Apple's Tim Cook May Have Sighed Relief on a Trump Win,-- Apple's China reliance may prove to be a vulnerable target for the tech giant under President-elect Donald Trump. Bloomberg's Mark Gurman says CEO Tim Cook has some maneuvers that could alleviate...,Finnhub,https://finnhub.io/api/news?id=b280f0c2876f1d9d923b6cd60f4490104ef8aec82f8dc000eeb40dc63d7e8aba,-- Apple's China reliance may prove to be a vulnerable target for the tech giant under President-elect Donald Trump. Bloomberg's Mark Gurman says CEO Tim Cook has some maneuvers that could alleviate...
2024-11-18T16:32:00Z,Apple Inc. stock outperforms competitors on strong trading day,Apple Inc. stock outperforms competitors on strong trading day,MarketWatch,https://finnhub.io/api/news?id=082964593096d46d415e3ba6db03f1ae22a363d6ff5375566ba82e5cf73357b7,Apple Inc. stock outperforms competitors on strong trading day
2024-11-18T16:10:16Z,Breakout Watch: Warren Buffett Stock Smashes Apple And Amazon,Breakout Watch: Warren Buffett Stock Smashes Apple And Amazon,DowJones,https://finnhub.io/api/news?id=1c26185258277029fdc66f52fd20283f757051f63b73df730bd23f9547584058,Breakout Watch: Warren Buffett Stock Smashes Apple And Amazon
2024-11-18T15:43:17Z,Barclays Highlights Key Semiconductor Trends Including Nvidia Blackwell Ramp and Apple iPhone Cuts,"Nvidia's Blackwell production capacity is projected to double to 40,000 wafers per month by April 2025",Yahoo,https://finnhub.io/api/news?id=bf53ad271fb7c93444807e2bdaac23d9b32e32ddb16154b9c753daf8884cf63f,"Nvidia's Blackwell production capacity is projected to double to 40,000 wafers per month by April 2025"
2024-11-18T14:00:15Z,Investors Heavily Search Apple Inc. (AAPL): Here is What You Need to Know,"Zacks.com users have recently been watching Apple (AAPL) quite a bit. Thus, it is worth knowing the facts that could determine the stock's prospects.",Yahoo,https://finnhub.io/api/news?id=30af3a20c6175df16d88d990b0716af725066309d169d5c6cf06a765ffbdb79b,"Zacks.com users have recently been watching Apple (AAPL) quite a bit. Thus, it is worth knowing the facts that could determine the stock's prospects."
2024-11-18T13:53:21Z,CGO: Revisiting This Fund Following The Election,The Calamos Global Total Return Fund yields 8.23% but has underperformed the MSCI World Index. Learn why CGO stock may not be ideal for core portfolios.,SeekingAlpha,https://finnhub.io/api/news?id=e2af11517c02585365c838c72baf8d65f02ff6b20e596261fe7889a2064d0b0b,The Calamos Global Total Return Fund yields 8.23% but has underperformed the MSCI World Index. Learn why CGO stock may not be ideal for core portfolios.
2024-11-18T13:23:49Z,Why Nvidia stock is ripe for another surge: Investor,More reasons Wall Street loves Nvidia.,Yahoo,https://finnhub.io/api/news?id=574727db930bbd065065786e4cf87a11a4b402e4ab6c8583b23a2a72f50f90c3,More reasons Wall Street loves Nvidia.
2024-11-18T13:03:10Z,PTF: Technology Dashboard For November,This monthly article series reports industry metrics in the information technology sector. It also serves as top-down analysis of sector ETFs like XLK or IYW. Read our November update here.,SeekingAlpha,https://finnhub.io/api/news?id=980d65518950cd7aa7800217c8cb89727a3c02e2278bb871b86e7072c76f9f0a,This monthly article series reports industry metrics in the information technology sector. It also serves as top-down analysis of sector ETFs like XLK or IYW. Read our November update here.
2024-11-18T12:21:00Z,"Coinbase, Robinhood Will Get a Trump Boost, Analysts Say. Lighter Rules Are on the Way.","Coinbase, Robinhood Will Get a Trump Boost, Analysts Say. Lighter Rules Are on the Way.",MarketWatch,https://finnhub.io/api/news?id=497466c8e6bb89a1899f38ac82d32c857b77497f817a0f6caae1ef8660c114f5,"Coinbase, Robinhood Will Get a Trump Boost, Analysts Say. Lighter Rules Are on the Way."
2024-11-18T11:30:00Z,Apple: Easy Gains Likely Over,"Nvidia recently surpassed Apple in market cap, as the Jensen Huang-led company demonstrated its AI growth inflection. Explore more details here.",SeekingAlpha,https://finnhub.io/api/news?id=2340a766679e5f87d285203e4412823b495d6da5b42191cf20875455a13f9afe,"Nvidia recently surpassed Apple in market cap, as the Jensen Huang-led company demonstrated its AI growth inflection. Explore more details here."
2024-11-18T11:11:00Z,The Turtle And The Pendulum,"The market is a pendulum that forever swings between unsustainable optimism, which makes stocks too expensive. Click to read.",SeekingAlpha,https://finnhub.io/api/news?id=b280afebe818dd13fa6b45f7809670b8f63a2593252f5bac118e73cfa530ca1f,"The market is a pendulum that forever swings between unsustainable optimism, which makes stocks too expensive. Click to read."
2024-11-18T10:47:05Z,Tata Electronics to acquire stake in Pegatron iPhone plant,"The acquisition will result in a joint venture, in which Tata will own 60% and Pegatron will have 40% interest.",Yahoo,https://finnhub.io/api/news?id=9afbb03728fdfe6c793146a49d8d665f560b083218fc23e503bed29a4b11d0ad,"The acquisition will result in a joint venture, in which Tata will own 60% and Pegatron will have 40% interest."
2024-11-18T10:46:33Z,Nvidia Looks Poised To Beat Q3 Earnings,"Financial writer sees another earnings beat for Nvidia Corporation in Q3 despite AI CAPEX growth, but has valuation concerns. Click for my NVDA earnings preview.",SeekingAlpha,https://finnhub.io/api/news?id=46e8797565d92b504dd93c76d3154f248dc20c55346214a1a1062f43b45cb953,"Financial writer sees another earnings beat for Nvidia Corporation in Q3 despite AI CAPEX growth, but has valuation concerns. Click for my NVDA earnings preview."
2024-11-18T10:40:43Z,Stock Market Today: Dow Jones Falls; Tesla Pops On Trump Move But Nvidia Skids On AI Chip Worries (Live Coverage),Stock Market Today: Dow Jones Falls; Tesla Pops On Trump Move But Nvidia Skids On AI Chip Worries (Live Coverage),DowJones,https://finnhub.io/api/news?id=0b9a9416ceb59e02443873cd4842d0265c7cdd1fbf7d96a47cbf3fa82f6b3011,Stock Market Today: Dow Jones Falls; Tesla Pops On Trump Move But Nvidia Skids On AI Chip Worries (Live Coverage)
2024-11-18T10:18:15Z,Warren Buffett Stocks: What's Inside Berkshire Hathaway's Portfolio?,Warren Buffett Stocks: What's Inside Berkshire Hathaway's Portfolio?,DowJones,https://finnhub.io/api/news?id=a13a474a728f6a6941798185e54e027029bf2fe7573323f6b7e7561bb528f075,Warren Buffett Stocks: What's Inside Berkshire Hathaway's Portfolio?
2024-11-18T09:41:00Z,"Billionaire Warren Buffett Sold 67% of Berkshire's Stake in Apple and Is Piling Into a Beloved Consumer Brand Whose Stock Has Soared by 7,000% Since Its IPO","The Oracle of Omaha has shed more than 615 million shares of Apple over the last year, and recently took a notable stake in one of America's most well-known consumer-facing businesses.",Yahoo,https://finnhub.io/api/news?id=c30a682bd54b7251778e3cba1a704624714ceb314c53486e1787ce431415731a,"The Oracle of Omaha has shed more than 615 million shares of Apple over the last year, and recently took a notable stake in one of America's most well-known consumer-facing businesses."
2024-11-18T08:31:47Z,Apple ups satellite investment stakes with latest Globalstar deal,"Apple’s move to raise its ante on extended D2D satellite connectivity services by another $1.5bn will up the stakes for both its OEM competitors and the MNO partner channel, which is searching for its own D2D differentiation.",Yahoo,https://finnhub.io/api/news?id=8ba9e39124289d2eef7ab965591e2c676827a5daccdce6982a911cda38ab4a11,"Apple’s move to raise its ante on extended D2D satellite connectivity services by another $1.5bn will up the stakes for both its OEM competitors and the MNO partner channel, which is searching for its own D2D differentiation."
2024-11-18T06:57:43Z,"Nasdaq 100 Infighting Makes QQQM, QQQ Risky Bets (Technical Analysis)",Technical analysis is crucial for understanding market trends and assessing probabilities and possibilities. Here is an analysis of Nasdaq 100's current charts.,SeekingAlpha,https://finnhub.io/api/news?id=92eff35e29a829f0aba008bd91879ecdb0f46e20ebb2c822e2d466b033599333,Technical analysis is crucial for understanding market trends and assessing probabilities and possibilities. Here is an analysis of Nasdaq 100's current charts.
2024-11-18T05:54:00Z,More Thoughts On The Smith Maneuver - October Dividend Income Report,"Since my Smith Manoeuvre strategy began, I have focused on creating a portfolio that would generate about 4% to 5% yield. Read more here.",SeekingAlpha,https://finnhub.io/api/news?id=64b217999106c492bc21134b455bd62c2efb70f2cb71c90e38f2201fc05be1bc,"Since my Smith Manoeuvre strategy began, I have focused on creating a portfolio that would generate about 4% to 5% yield. Read more here."
2024-11-18T04:02:08Z,Exclusive-Foxconn tells India recruiters: Nix marital status in iPhone job ads,"Apple supplier Foxconn has ordered the hiring agents that help recruit iPhone assembly workers in India to remove age, gender and marital criteria as well as the manufacturer's name in job advertisements, according to three people familiar with the matter and almost a dozen ads reviewed by Reuters.  The moves follow a Reuters investigation published June 25, which found that Foxconn excluded married women from jobs at its main India iPhone assembly plant, though it relaxed the practice during high-production periods.  Foxconn, which employs thousands of women at the iPhone factory at Sriperumbudur, near Chennai, outsources recruitment of assembly-line workers to third-party vendors.",Yahoo,https://finnhub.io/api/news?id=1d96fd62c187da5e20eb2fcccfd6635a1ea650ffaa6945943b9c77de9829a164,"Apple supplier Foxconn has ordered the hiring agents that help recruit iPhone assembly workers in India to remove age, gender and marital criteria as well as the manufacturer's name in job advertisements, according to three people familiar with the matter and almost a dozen ads reviewed by Reuters.  The moves follow a Reuters investigation published June 25, which found that Foxconn excluded married women from jobs at its main India iPhone assembly plant, though it relaxed the practice during high-production periods.  Foxconn, which employs thousands of women at the iPhone factory at Sriperumbudur, near Chennai, outsources recruitment of assembly-line workers to third-party vendors."
2024-11-18T00:38:14Z,"Apple: Decent Value Generated Despite Current Concerns, Hold","Economic variables like GDP growth, consumer confidence, exchange rate, and interest rates influence Apple's revenue growth. Read why AAPL stock is a Hold.",SeekingAlpha,https://finnhub.io/api/news?id=527f37245e9855d86eacbd8e47d19df1d1e0626018832dfbc7c1307d75345369,"Economic variables like GDP growth, consumer confidence, exchange rate, and interest rates influence Apple's revenue growth. Read why AAPL stock is a Hold."
2024-11-21T22:30:17Z,S&P 500: Is 6017 The Top?,"We warn investors that the post-election high may mark the top of the recent market surge, advising to sell at current levels. Read an analysis here.",SeekingAlpha,https://finnhub.io/api/news?id=409aed164e9189cf1c040d23d87bffb5ee359da3cc9b4aa5f99a76a484d2b687,"We warn investors that the post-election high may mark the top of the recent market surge, advising to sell at current levels. Read an analysis here."
2024-11-21T22:20:49Z,Apple is reportedly building a more conversational Siri powered by LLMs,"Apple is developing a new version of its voice assistant, Siri, powered by advanced large language models, according to sources cited by Bloomberg. This more conversational Siri is part of Apple's attempt to catch up in AI, where competitors have released impressive features, like Google's Gemini Live, that are far more natural to talk to than Siri. The new assistant reportedly will fully replace the Siri interface that users rely on today, and Apple is planning to release the feature in the spr",Yahoo,https://finnhub.io/api/news?id=94d793b94c84505014d17b22ba0c6bd62c1f326093ac96150c2a5005707e1a48,"Apple is developing a new version of its voice assistant, Siri, powered by advanced large language models, according to sources cited by Bloomberg. This more conversational Siri is part of Apple's attempt to catch up in AI, where competitors have released impressive features, like Google's Gemini Live, that are far more natural to talk to than Siri. The new assistant reportedly will fully replace the Siri interface that users rely on today, and Apple is planning to release the feature in the spr"
2024-11-21T21:00:02Z,Apple Readies More Conversational Siri in Bid to Catch Up in AI,"(Bloomberg) -- Apple Inc. is racing to develop a more conversational version of its Siri digital assistant, aiming to catch up with OpenAI’s ChatGPT and other voice services, according to people with knowledge of the matter. Most Read from BloombergTrump Promises Could Have Seismic Impact on Washington EconomyParis to Replace Parking Spaces With TreesTokyo’s Scorching Summers Focus Public Anger Against Tree CuttingNYC Mayor Adams Names Jessica Tisch to Lead Police Head Amid ProbesNew York’s Tran",Yahoo,https://finnhub.io/api/news?id=6e8425f824ee01d72a44ff8da33971802bcda19778ccacad6e04a59c35bf2143,"(Bloomberg) -- Apple Inc. is racing to develop a more conversational version of its Siri digital assistant, aiming to catch up with OpenAI’s ChatGPT and other voice services, according to people with knowledge of the matter. Most Read from BloombergTrump Promises Could Have Seismic Impact on Washington EconomyParis to Replace Parking Spaces With TreesTokyo’s Scorching Summers Focus Public Anger Against Tree CuttingNYC Mayor Adams Names Jessica Tisch to Lead Police Head Amid ProbesNew York’s Tran"
2024-11-21T19:39:00Z,The DOJ-Google Fight Comes Into Focus. Why It’s Finally Hitting Alphabet’s Stock.,"Until Thursday, shares of Google-parent Alphabet had largely escaped regulatory worry. A new government filing has changed that.",Yahoo,https://finnhub.io/api/news?id=41cb984010973b9df483fa16d55434bfff38fc27b8e3e0f810ba05596c429002,"Until Thursday, shares of Google-parent Alphabet had largely escaped regulatory worry. A new government filing has changed that."
2024-11-21T19:35:32Z,Planned Age-Verification Bill Would Put Burden on App Stores,The issue of who is responsible for age verification is a polarizing one.,Yahoo,https://finnhub.io/api/news?id=08dc61d152eff268dcd3abb8215249526fb3a2fe114450118b0c54a19b9fd31d,The issue of who is responsible for age verification is a polarizing one.
2024-11-21T17:31:27Z,DOJ Seeks Google Sale Of Chrome In Antitrust Case. Will Trump Make A Difference?,Google stock fell amid a DOJ request that a federal judge force parent Alphabet to sell its Chrome browser as part of antitrust remedies.,Yahoo,https://finnhub.io/api/news?id=2428d0a8ed7fdd926a3704ed5d68ba539217c980d86ef7322b8268e6935d5d5c,Google stock fell amid a DOJ request that a federal judge force parent Alphabet to sell its Chrome browser as part of antitrust remedies.
2024-11-21T17:01:00Z,WhatsApp rolls out voice message transcripts,"WhatsApp announced on Thursday it's rolling out voice message transcripts. The Meta-owned company says the new feature will come in handy when you're on the move or in a loud place where you can't listen to a voice message. A similar feature was announced last year for Apple's Message app, a top WhatsApp competitor, with the release of Apple's software update, iOS 17. With the new feature, voice messages can be transcribed into text to help you keep up with conversations when you're unable (or p",Yahoo,https://finnhub.io/api/news?id=e41150c2ac58270b41e65c0313b2eb1c422e61b774318c78650381acf3fe8242,"WhatsApp announced on Thursday it's rolling out voice message transcripts. The Meta-owned company says the new feature will come in handy when you're on the move or in a loud place where you can't listen to a voice message. A similar feature was announced last year for Apple's Message app, a top WhatsApp competitor, with the release of Apple's software update, iOS 17. With the new feature, voice messages can be transcribed into text to help you keep up with conversations when you're unable (or p"
2024-11-21T16:41:54Z,Apple: Berkshire And Buffett Are Right - It's Time To Sell,"Financial analysis of Berkshire Hathaway's reduction in Apple stock holdings due to valuation concerns, tax considerations, and geopolitical risks.",SeekingAlpha,https://finnhub.io/api/news?id=84d6b7ee256dd4941cdab18989cef18e43ec3432ad8dec7a21ff52b2d181120a,"Financial analysis of Berkshire Hathaway's reduction in Apple stock holdings due to valuation concerns, tax considerations, and geopolitical risks."
2024-11-21T16:32:00Z,Apple Inc. stock outperforms competitors despite losses on the day,Apple Inc. stock outperforms competitors despite losses on the day,MarketWatch,https://finnhub.io/api/news?id=af8192258a069ca1f80f3d4fae00e8ad2c340487b492f5005cc25b5a0785e380,Apple Inc. stock outperforms competitors despite losses on the day
2024-11-21T15:00:00Z,Allocating $50K In A Dividend Portfolio: Enhancing SCHD With 10 High-Yield Picks,Learn how to build a $50k dividend portfolio by enhancing Schwab U.S. Dividend Equity ETF with November's top 10 high dividend yield picks. Click for more on SCHD.,SeekingAlpha,https://finnhub.io/api/news?id=6d8998b00220ef3bfa30c498ca0dd75b039af0a1a45dd39f9af21f1e19e8c2ce,Learn how to build a $50k dividend portfolio by enhancing Schwab U.S. Dividend Equity ETF with November's top 10 high dividend yield picks. Click for more on SCHD.
2024-11-21T13:30:00Z,Artificial General Intelligence Is Coming: 1 Unstoppable Vanguard ETF to Buy Now,"AI systems capable of performing intellectual tasks at or above human level across all domains -- could arrive sooner than many expect, with some experts projecting development as early as 2026.  Unlike today's specialized artificial intelligence (AI) tools that excel at specific tasks like generating text or images, AGI would match or exceed human capabilities across any intellectual challenge.  This technological breakthrough could revolutionize human society and unlock an estimated $100 trillion in economic value, according to Nvidia CEO Jensen Huang.",Yahoo,https://finnhub.io/api/news?id=772fc713ebc3e66e30c17264f254c606035302814ddece3f28741d4736a940c3,"AI systems capable of performing intellectual tasks at or above human level across all domains -- could arrive sooner than many expect, with some experts projecting development as early as 2026.  Unlike today's specialized artificial intelligence (AI) tools that excel at specific tasks like generating text or images, AGI would match or exceed human capabilities across any intellectual challenge.  This technological breakthrough could revolutionize human society and unlock an estimated $100 trillion in economic value, according to Nvidia CEO Jensen Huang."
2024-11-21T13:15:00Z,The feds want Google to sell its Chrome browser,The Department of Justice (DOJ) said Wednesday that it wants Google (GOOGL) to sell its Chrome web browser as the government looks to break up the tech giant’s dominance in the search engine market.,Yahoo,https://finnhub.io/api/news?id=87637ea2104649fcead08a7c6fe5a66ab6c7a636599e5601d3b7d6910f9b7c22,The Department of Justice (DOJ) said Wednesday that it wants Google (GOOGL) to sell its Chrome web browser as the government looks to break up the tech giant’s dominance in the search engine market.
2024-11-21T12:59:58Z,Apple Proposes $100M Investment in Indonesia Amid iPhone 16 Ban,"Indonesia Blocks iPhone 16, Apple Fires Back with Massive $100M Investment",Yahoo,https://finnhub.io/api/news?id=75c3af3b54446bce906e9e055801436e238d683194b66688be31ea6d7ce3e4f3,"Indonesia Blocks iPhone 16, Apple Fires Back with Massive $100M Investment"
2024-11-21T11:48:00Z,Franklin Corefolio Allocation Fund Q3 2024 Commentary,"Franklin Corefolio Allocation Fund seeks capital appreciation through a diversified, multidisciplined approach. Read more here.",SeekingAlpha,https://finnhub.io/api/news?id=fcc06068c3ec693b4884222ce6899038c753f92f8972f5db9e4b7b24d6ca0a52,"Franklin Corefolio Allocation Fund seeks capital appreciation through a diversified, multidisciplined approach. Read more here."
2024-11-21T11:47:12Z,Apple begins selling News ads directly as its advertising ambitions grow,Axios reported that the tech giant is no longer relying on third-party vendors and is pitching marketers on ad units within the News feed and stories.,Yahoo,https://finnhub.io/api/news?id=d5732a73c02c117fe5d432b212635be1a3c03db3117ceb160b45c8c3ca0b84eb,Axios reported that the tech giant is no longer relying on third-party vendors and is pitching marketers on ad units within the News feed and stories.
2024-11-21T11:00:24Z,Apple proposes $100m investment to build plant in Indonesia,This move follows the South-East Asian country’s recent ban on iPhone 16 sales due to non-compliance with local component regulations.,Yahoo,https://finnhub.io/api/news?id=fcbe2f27724e2a36af3d769989a7061f0b831857c56c819b5eedc48140707586,This move follows the South-East Asian country’s recent ban on iPhone 16 sales due to non-compliance with local component regulations.
2024-11-21T10:28:00Z,"Tesla Stock Is Down After Nvidia Earnings, European EV Sales","Tesla Stock Is Down After Nvidia Earnings, European EV Sales",MarketWatch,https://finnhub.io/api/news?id=17a0b32893212a158b1a7b95b5bb154f30062fc104d11787162314f8b4601e52,"Tesla Stock Is Down After Nvidia Earnings, European EV Sales"
2024-11-21T10:05:00Z,Franklin Growth Opportunities SMA Fund Q3 2024 Commentary,The Franklin Growth Opportunities SMA Fund portfolio trailed the Russell 3000 Growth Index benchmark in Q3 2024. Click here to read the full commentary. ,SeekingAlpha,https://finnhub.io/api/news?id=5791876f981f6f2f24a7bbd1da374b51123ae451f17ce95b48fab168f8048b35,The Franklin Growth Opportunities SMA Fund portfolio trailed the Russell 3000 Growth Index benchmark in Q3 2024. Click here to read the full commentary. 
